날짜,뉴스,점수
2022-03-11,The Adam Project review: Netflix sci-fi movie lets Ryan Reynolds do his thing,0.0
2022-03-11,Movie Review: Netflix and Ryan Reynolds' 'The Adam Project',0.0
2022-03-11,Netflix's Pieces Of Her season 2 expected release date and cast,-0.1
2022-03-11,Every Bombshell From Anna Delvey's Tell-All Interview About Inventing Anna,0.0
2022-03-11,Is Tyler Henry for real? An honest account of a reading by the ...,0.8999999999999999
2022-03-11,"What's New on Netflix & Top 10s: March 11th, 2022",0.3181818181818182
2022-03-11,‘The Gentlemen’: Guy Ritchie TV Series Based On His Film From Miramax TV Eyes Netflix Greenlight,0.0
2022-03-12,"Best New Movies Added to Netflix This Week: March 12th, 2022",0.5681818181818181
2022-03-12,These 5 Netflix Movies & TV Shows Were Filmed In Quebec,0.0
2022-03-12,Best Jodie Comer movies and shows (and where to stream them),1.0
2022-03-12,Downtown St. Charles takes center stage for Netflix movie,-0.1
2022-03-12,Mitternacht im Pera Palace – Staffel 1,0.0
2022-03-13,Netflix Raises UK & Ireland Subscription Prices,0.0
2022-03-13,Top Boy is back for a second Netflix series,0.16666666666666666
2022-03-13,"What's Coming to Netflix This Week: March 14th to 20th, 2022",0.0
2022-03-13,Netflix Added 24 New Movies and Shows This Week,0.13636363636363635
2022-03-13,All of the Zoe Saldaña movies and shows on Netflix right now,0.2857142857142857
2022-03-13,W.Va. College's Culinary Arts Dean to Appear on Netflix Show,0.0
2022-03-13,"The Best New Movies To Stream On Netflix, Amazon, HBO ...",0.5681818181818181
2022-03-13,Ashburn pastry chef Steve Weiss stars on new Netflix show,0.13636363636363635
2022-03-13,Best Reality Shows on Netflix,1.0
2022-03-13,Netflix’s Haunting New War Movie Is Now A Global Hit,0.06818181818181818
2022-03-14,Netflix Stock Sinks To Lowest Point Since March 2020 Amid Increased Competition,-0.1
2022-03-14,Kidscreen » Archive » Netflix dominates the Annie Awards,0.0
2022-03-14,Netflix stock has now lost all its gains from the pandemic,0.0
2022-03-14,The Adam Project cast | List of Characters in Netflix movie,0.0
2022-03-14,‘Bad Vegan’ Review: Netflix’s Window Into Mysterious New York Cooking Sensation Is More Sad than Salacious,-0.1127272727272727
2022-03-14,The Most Popular Shows On Netflix Right Now Besides 'The Last Kingdom',0.3464285714285714
2022-03-14,Apple Loses Bid to Overturn Chicago's Unique 'Netflix Tax' (1),0.037500000000000006
2022-03-14,"Top 5 Chrome Extensions for Streaming Netflix, Disney+, and ...",0.5
2022-03-14,The 21 Best Spanish Shows on Netflix in 2023,0.5
2022-03-14,Joey King's 'The In Between' Headed to Netflix in April 2022,0.0
2022-03-15,"Netflix adds new Dr. Seuss series, expanding its children's programming",0.13636363636363635
2022-03-15,Has Netflix gone too far with creative licence in Formula 1?,0.3
2022-03-15,Drive to Survive — Netflix's F1 thrill ride returns but is it good ...,0.7
2022-03-15,Netflix Series Is Driving Force Behind Dramatic Shift in Formula 1 Fandom in US,-0.41666666666666663
2022-03-15,Netflix in Your Neighbourhood – The Adam Project Movie ...,0.0
2022-03-15,Obama Set To Narrate Netflix Series About World’s National Parks,0.0
2022-03-15,Anna Sorokin deported: Convicted con artist who inspired ...,0.0
2022-03-15,"Netflix Sets Launch Date for ‘Borgen – Power & Glory,’ Reveals First Look",0.25
2022-03-15,Ohio city sues Netflix and Hulu for piece of streaming pie,0.0
2022-03-15,"As it once again hikes up prices, is it time to ditch Netflix?",0.0
2022-03-16,Netflix tests a new feature that will raise prices for account sharing,0.13636363636363635
2022-03-16,Netflix wants to charge you more for moochers on your account,0.35
2022-03-16,Netflix testing new features to stop password sharing,0.13636363636363635
2022-03-16,Netflix makes Volodymyr Zelenskyy's show 'Servant of the People' available to U.S. streamers,0.4
2022-03-16,Netflix announces return of 'Servant of the People' starring Ukrainian President Volodymyr Zelenskyy,0.0
2022-03-16,Netflix streaming Ukraine leader's 'Servant of the People',0.0
2022-03-16,The Adam Project debuts at #1 on Netflix,0.0
2022-03-16,"Mike Myers’ Netflix Series ‘The Pentaverate’ Reveals Details, Premiere Date In First-Look Trailer & Photos",0.0
2022-03-16,Bad Vegan Review: Netflix True Crime Doc Is Tastier Than Other Scam-Based Alternatives,-0.1583333333333333
2022-03-16,‘Bridgerton’s Ruby Stokes Set As Lead Of Netflix’s ‘Lockwood & Co.’ Series Adaptation,0.0
2022-03-17,Netflix is streaming the Volodymyr Zelensky series that foreshadowed his presidency,0.0
2022-03-17,Netflix Testing New Guilt Tax For Password Sharers,0.13636363636363635
2022-03-17,Netflix will charge an additional fee to those who share their account with other households,-0.125
2022-03-17,Why Netflix Is Moving to Collect Fees From Password-Sharing Violators,0.0
2022-03-17,Netflix gives a peek at its upcoming Resident Evil series,-1.0
2022-03-17,"Netflix's Bad Vegan, a bonkers new scammer docuseries, is even crazier than The Tinder Swindler",-0.28181818181818175
2022-03-17,The true story that inspired Netflix's Rescued by Ruby,0.35
2022-03-17,'Anatomy of a Scandal' Trailer Shows Michelle Dockery ...,0.0
2022-03-17,Black Crab review – Sweden goes to war in throwaway Netflix thriller,-0.16666666666666666
2022-03-17,"Netflix Set to Shoot ‘The Crown’ Season 6 This Summer, Looks to Cast Teenage Prince William and Harry",0.0
2022-03-18,Netflix Looking to Crack Down on Sharing Accounts,-0.15555555555555559
2022-03-18,"After 15 Years, Netflix Just Announced a Change That Is ...",0.0
2022-03-18,Netflix knows you're sharing accounts - Here's how much you ...,0.2
2022-03-18,Review: 'Windfall' from Netflix is a satisfying throwback thriller,0.5
2022-03-18,Netflix's 'Windfall' Is a Perfect Class-Rage Noir,1.0
2022-03-18,Windfall Is the Latest Netflix Movie You Wish You Could Forget,0.5
2022-03-18,U2 Scripted Series From J.J. Abrams in the Works at Netflix (Exclusive),0.0
2022-03-18,Here are 10 of the best new movies and TV series released on ...,0.5681818181818181
2022-03-18,Black Crab review: an empty Netflix war movie at the wrong moment,-0.25555555555555554
2022-03-18,Meet the Voice Cast of Netflix's Human Resources,0.0
2022-03-19,Netflix royalty: Shonda Rhimes’s winning streak continues with Bridgerton and Inventing Anna,0.5
2022-03-19,Bridgerton season 2: Here’s the full scoop on Netflix’s Bridgerton season 2,0.35
2022-03-19,"Formula 1 CEO Stefano Domenicali will talk to drivers snubbing Netflix series Drive to Survive, after Verstappen claims",0.0
2022-03-19,Netflix series helps heal wounds of Turkey's Jews,0.0
2022-03-19,HBO Max's Scrapped The Shining Prequel Series Almost Went to Netflix,0.0
2022-03-19,Netflix's Windfall ending explained: Why did the Wife kill the CEO?,0.0
2022-03-19,Where was Black Crab filmed? Netflix filming locations explored,-0.16666666666666666
2022-03-19,Keegan Michael-Key and Jordan Peele reunite for new Netflix ...,0.13636363636363635
2022-03-19,'Top Boy' Season 2 Slang Guide: Street Talk on Netflix Show Explained,0.5
2022-03-19,Heartland season 16 release date | will Netflix series return?,0.0
2022-03-20,Netflix's Windfall: viewers seriously divided over Lily Collins thriller,-0.3333333333333333
2022-03-20,Netflix is adding 9 new movies and shows this week,0.13636363636363635
2022-03-20,J.J. Abrams' U2 Netflix Series - What We Know So Far,0.1
2022-03-20,"The Best New Movies To Stream On Netflix, HBO, Hulu, Amazon, Disney+, Peacock And Apple TV+ This Week",0.5681818181818181
2022-03-20,"What's Coming to Netflix This Week: March 21st to 27th, 2022",0.0
2022-03-20,"Where To Watch 'Call The Midwife' Season 11: Time, Live Stream, Netflix Streaming Info",0.13636363636363635
2022-03-20,Netflix docuseries featuring Vermont farm couple wins award,0.3
2022-03-20,Netflix Added 32 New Movies and Shows This Week,0.13636363636363635
2022-03-20,Netflix Bank of Dave movie filming takes over Leeds office starring James Bond and Game of Thrones stars,-0.4
2022-03-20,"Writers Guild Awards Keep Up Momentum for ‘CODA,’ ‘Don’t Look Up’",0.0
2022-03-21,Netflix’s ‘The Adam Project’ Is A Perfectly Good Movie I Will Never Think About Again,0.7
2022-03-21,"Netflix Tekken anime series announced, release date in 2022",0.0
2022-03-21,‘Money Heist’ Creator Álex Pina Renews Netflix Deal & Sets Pandemic-Inspired Series,0.0
2022-03-21,Bridgerton season 2 release time on Netflix (by time zone),0.0
2022-03-21,The Most Popular Shows On Netflix Right Now Besides 'Bad Vegan',0.17142857142857146
2022-03-21,What is 'Is It Cake?' Here's everything you need to know about ...,0.0
2022-03-21,'Young Wallander' Season 3: Will Netflix Renew or Cancel?,0.1
2022-03-21,Virgin Media O2 offering Netflix within new packages,0.13636363636363635
2022-03-21,The Most Popular Movies On Netflix Right Now Besides 'Black Crab',0.30476190476190473
2022-03-21,Netflix Signs Cooperation Agreement in Taiwan,0.0
2022-03-22,"Netflix announces two new games, with a third on the way",0.06818181818181818
2022-03-22,"Kid Cudi to Write, Direct and Star in Netflix’s ‘Teddy,’ Produced by Jeymes Samuel and Jay-Z",0.1
2022-03-22,Kid Cudi Directing and Starring in New Netflix Movie Teddy,0.13636363636363635
2022-03-22,"Kid Cudi To Direct and Star in Netflix's 'Teddy,' Produced by ...",0.1
2022-03-22,Netflix Top 10: ‘Bad Vegan’ Debuts With 27 Million Hours Consumed in First Five Days,0.01666666666666672
2022-03-22,Christina Ricci cast in Netflix’s Addams Family show Wednesday in meta twist,0.0
2022-03-22,"Windfall movie review: Netflix’s well-acted thriller entertains, but is a far cry from its Hitchcockian ambitions",0.1
2022-03-22,‘The Adam Project’ Dethroned In Netflix’s Top 10 List By A Surprising New Show,0.4454545454545455
2022-03-22,"‘Best. Christmas. Ever.’: Heather Graham, Brandy Norwood, Jason Biggs & Matt Cedeño To Star In Netflix Holiday Film From ‘Pet Sematary’s Mary Lambert",1.0
2022-03-22,The Upcoming U2 Netflix Series Should End With This Triumphant Red Rocks Moment,0.0
2022-03-23,"Netflix Could Reap $1.6 Billion per Year by Charging Password-Sharing Users Extra Fees, Analysts Say",0.0
2022-03-23,"Netflix Tries to Monetize Password Sharing, But Will It Work?",-0.1
2022-03-23,Why Netflix is launching a big crackdown on sharing accounts,0.0
2022-03-23,F1 plans talks with Netflix and drivers over DTS’s fake drama,-0.5
2022-03-23,Everything Leaving Netflix in April 2022,0.0
2022-03-23,Netflix Releases First Look Photos at Stranger Things Season 4,0.25
2022-03-23,Jay-Z and Kid Cudi Team Up To Produce and Direct Netflix ...,0.1
2022-03-23,Bad Vegan: Former Pure Food and Wine Employees React to ...,-0.16190476190476186
2022-03-23,'Dawson's Creek' Leaving Netflix in May 2022,0.0
2022-03-23,Jeff Foxworthy is more than that blue-collar comic in Netflix ...,0.375
2022-03-24,Netflix Buys Boss Fight Entertainment as It Builds Out Gaming Business,0.0
2022-03-24,‘Archive 81’ Canceled By Netflix After One Season,0.0
2022-03-24,‘Archive 81’ Canceled After One Season at Netflix,0.0
2022-03-24,"Archive 81 canceled by Netflix after one season, leaving Dan ...",0.0
2022-03-24,Netflix Is Turning The Seven Husbands Of Evelyn Hugo Into a Movie,0.0
2022-03-24,"Netflix Orders More ‘Love Is Blind’ & ‘Indian Matchmaking,’ Plus U.S. Version of ‘Love On The Spectrum’",0.25
2022-03-24,"Netflix adds two more games, will release its first first-person shooter title soon",0.375
2022-03-24,Netflix crackdown signals stricter sharing rules,0.0
2022-03-24,Netflix Announces Jewish Matchmaking Spinoff Series,0.0
2022-03-24,Boiling Point is the new film taking Netflix by storm,0.13636363636363635
2022-03-25,Netflix buys independent game developer Boss Fight in latest gaming acquisition,0.033333333333333326
2022-03-25,Bridgerton Netflix series vs. books: How the show changes ...,0.0
2022-03-25,How to watch Bridgerton season 2 on Netflix this week,0.0
2022-03-25,"Netflix Wants To Monetize Password Sharing, And It Could Change Subscription Models",0.2
2022-03-25,Charlotte Ritchie To Star In Season 4 Of Netflix’s ‘You’,0.0
2022-03-25,Max Verstappen annoyed by Netflix F1 show's portrayal of Lando Norris,-0.4
2022-03-25,When will 'Close Enough' Season 3 be on Netflix?,0.0
2022-03-25,Bob Saget tribute said to be headed to Netflix as a comedy ...,0.0
2022-03-25,"At the Oscars, the Real Competition Is Between Apple and ...",0.2
2022-03-25,Why is Netflix's Marilyn Monroe Biopic 'Blonde' Rated NC-17?,0.0
2022-03-26,Shows like 'Inventing Anna' you should watch next if you loved it,0.35
2022-03-26,Max Verstappen: Netflix ‘Made It Look Like Lando [Norris] Was a Bit of a D---’,0.0
2022-03-26,Bridgerton season 3 is not coming to Netflix in April 2022,0.0
2022-03-26,"Best New Movies Added to Netflix This Week: March 26th, 2022",0.5681818181818181
2022-03-26,Netflix has been trying to win best picture. This might finally be the year,0.6
2022-03-26,11 Shark Movies On Netflix (Our Picks),0.0
2022-03-26,Fate: The Winx Saga season 2 is not coming to Netflix in April 2022,0.0
2022-03-26,Heartland season 15 is not coming to Netflix in April 2022,0.0
2022-03-26,Warrior Nun season 2 is not coming to Netflix in April 2022,0.0
2022-03-26,The Worst Ryan Reynolds Movie Is Climbing On Netflix Again,-1.0
2022-03-27,What's Coming to Netflix This Week: March 28th to April 3rd ...,0.0
2022-03-27,Riverdale season 6 is not coming to Netflix in April 2022,0.0
2022-03-27,Enola Holmes 2 is not coming to Netflix in April 2022,0.0
2022-03-27,'A Brief History of Seven Killings' TV Adaptation Eying Move to ...,0.0
2022-03-27,Apple beats out Netflix with 'CODA' win at Oscars 2022,0.8
2022-03-27,"As energy returns to Melbourne, ‘Netflix effect’ supercharges F1",0.0
2022-03-27,'Bullsh*t the Game Show': Howie Mandel To Host Netflix Quiz ...,-0.4
2022-03-27,Netflix's 'Human Resources' Made the Best TV Episode of the ...,0.5
2022-03-27,Bridgerton Season 2 on Netflix: How did a bee sting kill dad ...,0.0
2022-03-27,Shadow and Bone season 2 is not coming to Netflix in April 2022,0.0
2022-03-28,Here Is Everything We Know So Far About Netflix's Blonde,0.05
2022-03-28,Netflix Shares Reel on Loss of Status as Pandemic Darling,0.0
2022-03-28,Netflix price increase 2022: How much Netflix will cost and ...,0.2
2022-03-28,'Baki Hanma' Season 2 Renewed at Netflix; Now In Production,0.0
2022-03-28,Report: Netflix Helped Spike Korean Content Consumption in ...,0.0
2022-03-28,"Nearly everyone who's watched Netflix's ""Bad Vegan"" is ...",-0.29999999999999993
2022-03-28,How Apple TV+ beat Netflix with 'CODA's' best picture Oscar,1.0
2022-03-28,The Most Popular Movies On Netflix Right Now Besides 'Blade Runner 2049',0.4619047619047619
2022-03-28,Netflix Oscar wins 2022: How many Oscars did Netflix win this year?,0.5333333333333333
2022-03-28,"Everything Coming to Netflix, Disney+, HBO Max & Other Major Streaming Services in April 2022",-0.03125
2022-03-29,"One-Third Of U.S. Netflix Subscribers Share Their Passwords, Survey Finds",0.0
2022-03-29,‘Bridgerton’ Season 2 Sets Netflix Opening Weekend Viewing Record (Exclusive),0.0
2022-03-29,Gillian Anderson Signs First-Look Television Deal With Netflix (EXCLUSIVE),0.0
2022-03-29,‘The Ultimatum: Marry or Move On’ Trailer Teases Netflix’s Newest Dating Experiment (VIDEO),0.0
2022-03-29,Netflix Sets Up Eastern European Hub in Poland,0.0
2022-03-29,‘The Adam Project’ Soars: Ryan Reynolds Becomes Only Actor With 3 Films on Netflix’s All-Time Top 10 List (Exclusive),0.25
2022-03-29,Netflix & ACTF launch incubator for kids series concepts,0.0
2022-03-29,"What's New on Netflix & Top 10s: March 29th, 2022",0.3181818181818182
2022-03-29,All American season 4 is not coming to Netflix in April 2022,0.0
2022-03-29,Virgin River season 4 is not coming to Netflix in April 2022,0.0
2022-03-30,‘Spy Kids’ Reboot Set at Netflix,0.0
2022-03-30,What’s Coming & Going From Netflix in April 2022,0.0
2022-03-30,"Netflix opens office in “key market” Poland, pledging to create ...",0.0
2022-03-30,"Daniel Kaluuya Pens Dystopian Drama for Netflix, Michael Fassbender Exec Producing",0.0
2022-03-30,Ryan Reynolds Is Rocking Netflix! Has 3 Films In The List Of Top 10 Movies Of All-Time,0.5
2022-03-30,Netflix Orders Interactive Rom-Com ‘Choose Love’ From Josann McGibbon,0.5
2022-03-30,Netflix Releases 1st Trailer for 'The Ultimatum',0.0
2022-03-30,What is The Bubble starring Karen Gillan about?,0.0
2022-03-30,Why does Netflix cancel so many shows?,0.5
2022-03-30,More B.C. movies like The Adam Project? Netflix extends agreement with Langley’s Martini studios,0.5
2022-03-31,Netflix and A.S.O. announce docuseries on Tour de France ...,0.0
2022-03-31,Tour de France confirms Netflix series and eight teams that ...,0.0
2022-03-31,Netflix Will Follow the 2022 Tour de France in a New Documentary Series,0.06818181818181818
2022-03-31,"Kano to star in new dystopian Netflix film, The Kitchen",0.13636363636363635
2022-03-31,"More like this please! The wild, conspiracy-filled Netflix documentary that you can’t resist",0.24166666666666667
2022-03-31,Abercrombie & Fitch Gets the Netflix Documentary Treatment In New Trailer,0.06818181818181818
2022-03-31,Netflix set to open new office in Poland,0.06818181818181818
2022-03-31,10 Best Time Travel Movies On Netflix After 'The Adam Project',1.0
2022-03-31,Review: Netflix's The Bubble is the surprisingly funny COVID ...,0.25
2022-03-31,"Netflix will gain 'The Blind Side,' season 4, part 2 of 'Ozark' in ...",-0.5
2022-04-01,New on Netflix: April 2022 Releases,0.13636363636363635
2022-04-01,"7 new Netflix movies, Sing 2, and everything you can now watch at home",0.13636363636363635
2022-04-01,New shows and movies to watch on Netflix Canada this ...,0.13636363636363635
2022-04-01,"'The Bubble' spoofs pandemic and Hollywood with broad, dino ...",0.0625
2022-04-01,9 Netflix movies to watch (and 5 to skip) in April 2022,0.0
2022-04-01,"17 New TV Shows to Watch in April 2022 on Netflix, Hulu ...",0.13636363636363635
2022-04-01,The Seven Husbands of Evelyn Hugo is getting a Netflix film ...,0.0
2022-04-01,"What really happened to Gerald Cotten, Netflix’s Crypto King?",0.2
2022-04-01,"16 best movies coming to Netflix in April: 'Blade,' 'Love Actually'",0.5
2022-04-01,A Beloved Tom Hanks Movie Is Newly On Netflix,0.41818181818181815
2022-04-02,From video store chain to global entity: How Netflix changed entertainment,0.0
2022-04-02,What's Good on Netflix: Watch 50 Popular Movies and Shows ...,0.6499999999999999
2022-04-02,Will There Be a Season 6 of Netflix's 'The Last Kingdom'?,0.0
2022-04-02,Netflix Pumps Brakes on Will Smith Action Film ‘Fast and Loose’,0.07435897435897437
2022-04-02,Arcane season 2 is not coming to Netflix in April 2022,0.0
2022-04-02,Pieces Of Her: 9 Big Differences Between The Book And The ...,0.0
2022-04-02,"Kid Cudi Will Write, Direct, and Star in New Netflix Movie 'Teddy'",0.11818181818181818
2022-04-02,Woke Disney: 10 families who are swearing off Disney due to its left-leaning politics,-0.125
2022-04-02,Pacific Rim the Black Season 2 Release Date and Official Trailer Update,-0.16666666666666666
2022-04-03,Netflix Added 91 New Movies and Shows This Week,0.13636363636363635
2022-04-03,Netflix halts development on Will Smith action movie ‘Fast and Loose’,0.07435897435897437
2022-04-03,'Vikings: Valhalla' Season 3 to Start Filming in May 2022,0.0
2022-04-03,"Netflix’s Head of Anime Says Half of Global Subscribers Watch Japanese Animation, Bullish on Growth (Exclusive)",-0.05555555555555555
2022-04-03,Stream These 10 Titles Before They Leave Netflix in April,0.0
2022-04-03,'Colony' Seasons 1-3 Leaving Netflix in May 2022,0.0
2022-04-03,3 Things About Netflix That Smart Investors Know,0.21428571428571427
2022-04-03,Stranger Things season 4 is not coming to Netflix in April 2022,0.0
2022-04-03,Legacies season 4 is not coming to Netflix in April 2022,0.0
2022-04-03,"Netflix's Lift Adds Kevin Hart, Vincent D'Onofrio, and Billy Magnussen To Cast",0.0
2022-04-04,Why Netflix Should Sell Ads – Stratechery by Ben Thompson,0.0
2022-04-04,Want Cheaper Netflix? Stop Sharing Your Password,0.0
2022-04-04,The Most Popular Movies On Netflix Right Now Besides 'The Blind Side',0.22142857142857142
2022-04-04,Best TV Series to Watch on Netflix Right Now,0.6428571428571428
2022-04-04,11 Best New Movies on Netflix: April 2022's Freshest Films to Watch,0.5681818181818181
2022-04-04,Billie Piper Set To Star In Series Adaptation Of Terri White Memoir ‘Coming Undone’ In The Works At Netflix From Bad Wolf,-0.3499999999999999
2022-04-04,Chris Packham defends BBC licence fee: 'Where's Netflix ...,0.0
2022-04-04,New 'Netflix' spy series filming continues near St Albans,0.11818181818181818
2022-04-04,Will Smith Film Fast And Loose Paused By Netflix After Oscars ...,0.06153846153846154
2022-04-04,"10 movies and TV shows to watch this week on Netflix, Disney+ Hotstar, and more",0.5
2022-04-05,"Nancy Meyers to Write, Direct and Produce New Movie for Netflix",0.11818181818181818
2022-04-05,Netflix Makes Deal With Nancy Meyers To Write & Direct Untitled Ensemble Comedy,0.1
2022-04-05,We Have Some Ideas for Nancy Meyers's Netflix Movie,0.0
2022-04-05,Netflix made a short movie category after Pete Davidson's 'SNL' plea,0.0
2022-04-05,Netflix Creates 'Short-Ass Movies' Category Following SNL Sketch,0.0
2022-04-05,Flogging Channel 4 won’t bring about the longed-for British reply to Netflix,0.0
2022-04-05,"Plex adds a guide to what's on Netflix, HBO Max, and more",0.5
2022-04-05,‘Netflix Is A Joke: The Festival’ Adds More Shows Including Billy Eichner To Host ‘Stand Out: An LGBTQ+ Celebration’,0.5
2022-04-05,'Ronny Chieng: Speakeasy' Netflix Comedy Special Review,0.35714285714285715
2022-04-05,'Trivia Quest' on Netflix Review: A Wasted Opportunity,-0.2
2022-04-06,Netflix introduces new category after Pete Davidson's 'SNL' musical sketch,0.06818181818181818
2022-04-06,The Old-Timers Are Chasing Netflix,0.0
2022-04-06,Netflix's The Queen's Ball: A Bridgerton Experience,0.0
2022-04-06,Rob Lowe — and His Son — to Star in Netflix Comedy ‘Unstable’,0.0
2022-04-06,When does The Ultimatum finale premiere on Netflix?,0.0
2022-04-06,Save a massive 64% on the best Netflix and NOW TV deal of ...,0.5
2022-04-06,The Biggest Differences Between Netflix's The Witcher And ...,0.0
2022-04-06,"What's New on Netflix & Top 10s: April 6th, 2022",0.3181818181818182
2022-04-06,10 Netflix hidden gems you need to see,-0.16666666666666666
2022-04-06,"Stream It Or Skip It: 'All Hail' on Netflix, a Nutty Argentinian Comedy About a Disgraced Weatherman",0.0
2022-04-07,Netflix's The Ultimatum: All of the cast's Instagram handles,0.0
2022-04-07,"If you prefer short films, Netflix now has the perfect category for ...",0.5
2022-04-07,Netflix’s First Nigerian Original Series ‘Blood Sisters’ Unveils Trailer,0.3125
2022-04-07,Oprah and Viola Davis Interview - Netflix Special 2022,0.35714285714285715
2022-04-07,Laura Dern & Liam Hemsworth To Star In Netflix Romance ‘Lonely Planet’; ‘Unbelievable’s Susannah Grant Directing,-0.175
2022-04-07,"'Bridgerton' books popular again, thanks to Netflix series",0.4
2022-04-07,Netflix Unearths John Wayne Gacy Audio Tapes in New ...,0.13636363636363635
2022-04-07,Barack Obama Narrates A Gorgeous New Netflix Series: 'Our ...,0.41818181818181815
2022-04-07,Ana de Armas’ ‘Blonde’ is first NC-17 rated Netflix movie,0.125
2022-04-07,"What's New on Netflix & Top 10s: April 7th, 2022",0.3181818181818182
2022-04-08,"Netflix might buy a piece of NFL Films, report claims",0.0
2022-04-08,'The Crown' Prequel In Early Consideration at Netflix,0.1
2022-04-08,Netflix show 'Old Enough' has experts torn on whether it's good,0.26666666666666666
2022-04-08,"Netflix’s Reed Hastings, Ted Sarandos See Compensation Decline in 2021",0.0
2022-04-08,HBO Max Boss Predicts Ads Are Coming to Netflix Eventually,0.0
2022-04-08,Viola Davis Will Film A Sit Down With Oprah Winfrey For Netflix,-0.15555555555555559
2022-04-08,"The Night House, 6 new Netflix movies, and everything new you can watch",0.13636363636363635
2022-04-08,"What's New on Netflix & Top 10s: April 8th, 2022",0.3181818181818182
2022-04-08,Bridgerton Season 2: Why it matters that Netflix changed the ...,0.0
2022-04-08,Netflix Releases Trailer on John Wayne Gacy Docu,0.0
2022-04-09,Where Was 'The Ultimatum' Filmed? The Full Story Behind ...,-0.025000000000000022
2022-04-09,Julie Delpy Says Netflix & Canal+ Have Canceled Her Comedy Series ‘On The Verge’ After One Season,0.0
2022-04-09,Sienna Miller and Naomi Scott on Anatomy of a Scandal: 'It ...,0.0
2022-04-09,How Sotheby's Combined NFTs And A Netflix Attitude In A ...,0.0
2022-04-09,List of Jennifer Garner Movies on Netflix,0.0
2022-04-09,List of Ryan Reynolds Movies on Netflix,0.0
2022-04-09,Top 4 Hidden Features of Netflix,0.16666666666666669
2022-04-09,"Netflix Is It Cake: 10 Unpopular Opinions, According To Reddit",0.0
2022-04-09,4 geniales películas de ciencia ficción espacial para ver en Netflix y otras plataformas de streaming...,0.0
2022-04-09,Yaksha: Ruthless Operations,-1.0
2022-04-10,"What's Coming to Netflix This Week: April 11th to 17th, 2022",0.0
2022-04-10,Barack Obama brings Netflix's new nature documentary 'Our Great National Parks' to life,0.31212121212121213
2022-04-10,Thar Release Date Out! Find Out From When Anil Kapoor & Harsh Varrdhan Starrer Will Start Streaming On Netflix,-0.2
2022-04-10,Movies are too long. Netflix thankfully answered Pete Davidson's call on 'SNL.',-0.05
2022-04-10,Mark Wahlberg Takes Top Spot on Netflix Movie Charts,0.5
2022-04-10,Inside Chris Rock's Expensive Divorce to Wife Malaak ...,-0.5
2022-04-11,"Netflix Launches ‘Two Thumbs Up’ User Content Ratings for TV Shows, Movies You Love",0.5
