날짜,뉴스,점수
2022-08-12,Mindy Kaling’s Netflix hit 'Never Have I Ever' is a phenomenon,0.0
2022-08-13,‘Purple Hearts’ Star Sofia Carson: We Wanted to Avoid “Taking Any Sides”,0.0
2022-08-13,'Fall' movie ending explained: What happened to Hunter?,0.0
2022-08-13,Woman shares video of the moment her plane crashed on way to the Maldives,0.0
2022-08-14,'The Netflix effect': Why Western women are heading to South ...,0.0
2022-08-14,Day Shift: Viewers saying the same thing about Netflix's new Jamie Foxx film,0.06818181818181818
2022-08-14,Should You Watch 'Day Shift on Netflix?,0.0
2022-08-14,"The Top 10 Movies And Shows On Netflix Today: August 14, 2022",0.5
2022-08-14,The Best New Movies And Shows On Netflix This Week,0.5681818181818181
2022-08-14,Here's Why Netflix Stock May Be Riskier Than You Think,0.0
2022-08-14,‘Purple Hearts’ star Sofia Carson defends Netflix film after backlash,0.0
2022-08-14,Disney Having More Subscribers Than Netflix Isn't The Whole ...,0.35
2022-08-14,A new series surpasses Stranger Things as Netflix's most watched series,0.3181818181818182
2022-08-14,Las 5 series de Netflix que más opciones tienen de convertirse en el próximo Stranger Things,0.0
2022-08-15,‘The Sandman’ Dethroned In Netflix’s Top 10 List By A New Show,0.3181818181818182
2022-08-15,Why Does Everything On Netflix Look Like That?,0.0
2022-08-15,"Netflix Tests New 4-Day, 2-Episode Release Strategy with ...",0.13636363636363635
2022-08-15,Netflix puts an entire Bay Area campus up for sublease amid ...,0.0
2022-08-15,Netflix Stock: A Very Painful Transition From Growth To Value,-0.9099999999999999
2022-08-15,The 10 Best Games on Netflix Games Subscription Service,1.0
2022-08-15,The Top 10 Movies And Shows On Netflix Today: August 15 ...,0.5
2022-08-15,"There’s No ‘Locke And Key’ Season 4 Coming To Netflix, And That’s A Good Thing",0.35
2022-08-15,Netflix’s “Purple Hearts” Uses Diabetes Insulin Rationing for Military Propaganda,-0.1
2022-08-15,The Most Popular Movies On Netflix Right Now Besides 'Day Shift',0.4619047619047619
2022-08-16,‘The Sandman’ Had An Incredible 10-Day Opening On Netflix,0.9
2022-08-16,How the team behind Netflix's 'Untold' reframed the Manti Te'o girlfriend hoax,-0.4
2022-08-16,The appeal of ad-supported tiers (and what that means for ...,0.0
2022-08-16,Apple Avoids Back 'Netflix Taxes' Owed to Chicago in Settlement,0.0
2022-08-16,Netflix Share Price (NFLX) Burns Shorts as 'Extreme ...,-0.125
2022-08-16,Is Netflix Wasting Hundreds of Millions on Games?,0.0
2022-08-16,Netflix and meow: Cat documentary features CVM's Kornreich ...,0.0
2022-08-16,How many episodes is drama miniseries Echoes on Netflix?,0.5
2022-08-16,Netflix to sublease Bay Area campus,0.0
2022-08-16,"Netflix Top 10 Shows and Movies: New and Trending Today, August 16",0.3181818181818182
2022-08-17,"Netflix’s ad-supported plan may block offline viewing, code suggests",0.0
2022-08-17,"‘Wednesday’ Trailer: First Look At Tim Burton’s Addams Family Reimagining “Full Of Mystery, Mayhem & Murder”",0.3
2022-08-17,‘Wednesday’ Trailer: Catherine Zeta-Jones Slinks Into Netflix’s ‘Addams Family’ Series,0.0
2022-08-17,Wednesday Addams Goes to Goth School in First Netflix Trailer,0.25
2022-08-17,"Netflix’s Purple Hearts: The backlash to the controversial film, explained",0.55
2022-08-17,Netflix’s New Manti Te’o Doc Is a Must-Watch for Many Reasons,0.3181818181818182
2022-08-17,‘The Mole’ Reboot Ordered at Netflix,0.0
2022-08-17,"The Best New Movies And Shows On Netflix Today: August 17, 2022",0.5681818181818181
2022-08-17,'Look Both Ways': Interesting details you missed in Netflix movie,0.5
2022-08-17,"How to Cancel Your Netflix Subscription on iPhone, iPad, and ...",0.0
2022-08-18,"Echoes, Netflix review — twin sisters swap lives in hammy box ...",0.0
2022-08-18,Echoes review – devious identical twins lead Netflix’s dull thriller series,-0.2916666666666667
2022-08-18,‘Echoes’ Review: Netflix Thriller Series Is Confusing ...,-0.3
2022-08-18,Netflix’s ad-supported plan likely to have another drawback: No video downloads,0.0
2022-08-18,Netflix Reportedly Removing Offline Viewing Downloads for ...,0.0
2022-08-18,Netflix’s ad-supported plan will block offline content viewing,0.0
2022-08-18,Manti Te'o on Netflix's Untold Documentary,0.0
2022-08-18,Netflix sues creators of unofficial Bridgerton musical,0.0
2022-08-18,Netflix debuts trailer for new ‘Addams Family’ series ‘Wednesday’,0.13636363636363635
2022-08-18,Netflix Fans Are Applauding Look Both Ways’ Plot For One Reason,0.0
2022-08-19,Is the value of a Netflix subscription diminishing?,0.0
2022-08-19,"Coach K, USA Basketball Featured in Netflix Documentary ...",0.0
2022-08-19,Netflix releases surprise episode of The Sandman,0.0
2022-08-19,Look Both Ways review: Why the Netflix drama starring Lili Reinhart misses the mark,0.0
2022-08-19,"New Movies and Shows on Netflix: August 19th, 2022",0.13636363636363635
2022-08-19,‘Echoes’ Cast and Character Guide: Who’s Who in Netflix’s ...,0.0
2022-08-19,The Best New Movies And Shows On Netflix Today: August 19 ...,0.5681818181818181
2022-08-19,"'Criminal Minds', 'The Originals' and 'Reign' Return to Netflix ...",-0.4
2022-08-19,'The Next 365 Days' is out. Will Netflix return with 365 Days 4?,0.0
2022-08-19,"The Best New Movies And Shows To Stream On Netflix, Amazon, HBO, Apple TV+, Disney+, And Paramount+ This Weekend",0.5681818181818181
2022-08-20,10 Most Anticipated Netflix Movies Coming Fall 2022,0.5
2022-08-20,"Netflix won’t run ads in kids programs, new movies",0.13636363636363635
2022-08-20,10 Great Movies To Watch Before They Disappear From Netflix At The End Of August,0.8
2022-08-20,Alison Brie Calls Netflix’s Surprise ‘GLOW’ Cancellation “The Great Heartbreak of My Career”,0.8
2022-08-20,Spekulasjonene hagler etter ny kongelig Netflix-film: – Flere er ...,0.0
2022-08-20,"Manti Te'o, subject of high-profile catfishing story, talks 'Untold ...",-0.16666666666666666
2022-08-20,Day Shift sur Netflix : les twittos veulent un spin-off pour les ...,0.0
2022-08-20,Review: Bubba Wallace Netflix documentary,0.0
2022-08-20,10 Clichéd Netflix Series With Predictable Endings,-0.2
2022-08-20,"Whats new on Netflix? Top 10 list of TV Shows, Movies",0.3181818181818182
2022-08-21,Netflix’s ad-supported tier might not play commercials during new movies,0.13636363636363635
2022-08-21,Netflix's Echoes: Viewers have same complaint about new drama,-0.05454545454545454
2022-08-21,Netflix 'The Redeem Team' Doc Produced by LeBron James ...,0.0
2022-08-21,"The Best New Movies And Shows On Netflix Today: August 21, 2022",0.5681818181818181
2022-08-21,Schitt's Creek Fave Dan Levy Is Heading To Netflix For First ...,0.25
2022-08-21,All of the original Netflix shows that are ending this year — 2022,0.375
2022-08-21,That ’70s Show and 6 more older shows that should stream on Netflix,0.3333333333333333
2022-08-21,Фильм 365 дней 4 часть (Netflix) - будет ли продолжение ...,0.0
2022-08-22,Netflix's Mo: 'Rebranding' Palestine,0.0
2022-08-22,Netflix explores cloud gaming as it looks for new hires,0.13636363636363635
2022-08-22,"‘Glass Onion: A Knives Out Mystery’ Sets Netflix Premiere Date, Releases First-Look Images",0.0
2022-08-22,Netflix ad-supported plan to have some commercial-free content: Report,0.0
2022-08-22,Netflix Is Now The Worst-Performing Stock In The S&P 500 As Shares Plunge Over 60% In 2022,0.0
2022-08-22,Will The Sandman Season 2 Happen on Netflix?,0.0
2022-08-22,Will there be another season of Netflix's Echoes?,0.0
2022-08-22,"‘Lou’ Trailer, First Look: Allison Janney & Jurnee Smollett Lead Netflix’s Bad Robot-Produced Action-Thriller",-0.22499999999999992
2022-08-22,"Netflix Top 10 Shows and Movies: New and Trending Today, August 22",0.3181818181818182
2022-08-22,The ending of Look Both Ways explained,0.0
2022-08-23,Netflix's Mo Keeps the Faith For Insightful Muslim-American ...,0.0
2022-08-23,"Netflix adds Heads Up! to its games roster with decks based on its hit shows, including ‘Stranger Things’",0.0
2022-08-23,Netflix Debuts First Trailer for Tyler Perry’s ‘A Jazzman’s Blues’,0.25
2022-08-23,The first trailer for Netflix’s Lou lets Allison Janney go full John Wick,0.3
2022-08-23,"Netflix's Sins of Our Mother: Doomsday cults, murder and the makings of another true crime megahit",0.35
2022-08-23,Netflix’s Bling Ring Docuseries: Get a First Look and Find Out When It Premieres,0.25
2022-08-23,"John McAfee faked his death and is 'still alive' in Texas, ex-girlfriend claims in Netflix doc",0.1
2022-08-23,"Netflix movie starring Emily Blunt, Chris Evans now filming in Savannah",0.0
2022-08-23,Michael Pollan's New Netflix Series Is All About Psychedelics ...,0.13636363636363635
2022-08-23,"And1, once a wildly popular basketball brand and subject of a new Netflix documentary, has deep Philadelphia r",0.11393939393939394
2022-08-24,Mo on Netflix: what Mohammed Amer's new show really means.,0.16818181818181818
2022-08-24,What Netflix Needs: Some 'Mo' Houston – Texas Monthly,0.0
2022-08-24,Netflix’s ‘Mo’ Brings Laughs and Empathy to a Palestinian Experience TV Rarely Acknowledges: TV Review,0.3
2022-08-24,Netflix Is Dropping Some Highly Anticipated Originals in September 2022,0.16
2022-08-24,"New on Netflix September 2022: Blonde, Clueless, Cobra Kai ...",0.06818181818181818
2022-08-24,Here’s Everything Coming to Netflix in September 2022,0.0
2022-08-24,RespectAbility and Netflix Partner On New Program for ...,0.13636363636363635
2022-08-24,The Best New Movies And Shows On Netflix Today: August 24 ...,0.5681818181818181
2022-08-24,How to play Netflix Games for free,0.4
2022-08-24,"'Lost Ollie' Netflix set in Kentucky, written by Shepardsville native",0.0
2022-08-25,Houston oozes through the screen in Mo Amer’s new Netflix series,-0.03181818181818183
2022-08-25,‘Umbrella Academy’ Renewed for Fourth and Final Season at Netflix,0.0
2022-08-25,‘Umbrella Academy’ to End With Season 4 on Netflix,0.0
2022-08-25,The Umbrella Academy Renewed for Fourth and Final Season at Netflix,0.0
2022-08-25,Robbie Williams Documentary Series Headed to Netflix,0.0
2022-08-25,‘Me Time’ Review: Kevin Hart And Mark Wahlberg Star In Netflix Comedy That’s Laugh And Chemistry Free,0.35
2022-08-25,"Steve Blackman Developing ‘Horizon Zero Dawn’ TV Adaptation, ‘Orbital’ Series As ‘Umbrella Academy’ Showrunner Renews Netflix Deal",0.0
2022-08-25,Netflix Is Using NFTs to Harvest Engagement Data. And TV ...,0.0
2022-08-25,Echoes on Netflix's ending explained,0.0
2022-08-25,Ads on Netflix Could Generate an Additional $2.2 Billion in ...,0.0
2022-08-26,Netflix Eyes $7-to-$9 Price for Its New Ad-Supported Plan,0.13636363636363635
2022-08-26,Hyundai Retro Models Rev Up Netflix's 'Seoul Vibe',0.0
2022-08-26,What’s Coming & Going From Netflix in September 2022,0.0
2022-08-26,Netflix's Resident Evil Series Cancelled After One Season,-1.0
2022-08-26,The Best New Movies And Shows On Netflix Today: August 26 ...,0.5681818181818181
2022-08-26,Why ‘Delhi Crime’ Season 2 Should Be Your Next Netflix Binge,0.0
2022-08-26,‘Purple Hearts’ Quietly Became One Of Netflix’s Most Successful Movies Ever,0.4166666666666667
2022-08-26,Should You Watch 'Me Time' on Netflix?,0.0
2022-08-26,Netflix’s ‘Partner Track’ star Arden Cho talks sexism and racism in big law,0.0
2022-08-26,Vilano Beach picked as location for new Netflix series,0.13636363636363635
2022-08-27,Netflix with ads could cost between $7 and $9 per month,0.0
2022-08-27,Netflix is working on gamertags,0.0
2022-08-27,4 Little-Known Perks of Your Netflix Subscription,0.0
2022-08-27,"Netflix Cancels ‘Resident Evil’ After One Season, Which Is No Great Tragedy",-0.7
2022-08-27,How Mo Amer Balances The Funny and Tragic,-0.25
2022-08-27,Fans of Netflix series disrupt peaceful Swiss village,0.25
2022-08-27,"Wow, Netflix's BioShock Movie Sounds Like It Could Be ...",0.1
2022-08-27,Gone by Thursday: 10 terrific movies leaving Netflix this month,0.0
2022-08-27,You Won’t Expect What Movie Is About To Destroy A Netflix Record,-0.2
2022-08-27,"Stream It Or Skip It: ‘History 101: Season 2’ on Netflix, a Documentary Series That Condenses Complex Topics Into 20-Minute Info-nuggets",-0.15
2022-08-28,Here’s How Much Netflix’s Ad-Infused Cheaper Subscription Plan May Cost,0.2
2022-08-28,"‘Manifest’ Gets Season 4 Premiere Date, Teaser Trailer On Netflix",0.0
2022-08-28,"Netflix Sets 'Manifest' Season 4, Part 1 Premiere Date",0.0
2022-08-28,Manifest Season 4 Premiere Date Revealed — Here's When the Final Season Arrives on Netflix,0.0
2022-08-28,Netflix Expands Nippon TV Partnership With 13 Anime Titles To Stream In Select Countries,0.0
2022-08-28,What's Coming to Netflix This Week: August 28th to ...,0.0
2022-08-28,10 New Movies to Stream in September 2022 on Netflix ...,0.13636363636363635
2022-08-28,Will WWE Raw and SmackDown going to Netflix impact the WWE Universe?,-0.23076923076923078
2022-08-28,"How NASCAR is Stealing a Page from Netflix, F1 'Drive to ...",0.0
2022-08-28,15 Under-the-Radar TV Shows That Deserve Your Attention,0.0
2022-08-29,Netflix's Ad-Supported Subscription Could Cost $7 to $9,0.0
2022-08-29,Netflix’s ad-supported plan could cost as low as $7,0.0
2022-08-29,Netflix with ads could cost between $7 and $9 a month,0.0
2022-08-29,"Netflix Turns 25, Cues Up Nostalgia Reel For Its Red-Envelope Days",0.0
2022-08-29,Netflix 25th Anniversary: Company Shares the First DVD It Ever Shipped,0.25
2022-08-29,9 films currently streaming on Netflix that were shot in ...,0.0
2022-08-29,‘Inventing Anna’ Ignites Defamation Suit Against Netflix,0.0
2022-08-29,"Netflix Restructures Studio Film Team, Top Executive Tendo Nagenda to Exit",0.5
2022-08-29,Nippon TV Seals Major Anime License Deal With Netflix,0.0625
2022-08-29,New Netflix series ‘Mo’ tells story of a Palestinian refugee family in Texas,0.13636363636363635
2022-08-30,Mexico's Queen of the Pacific sues Netflix over series,0.0
2022-08-30,Netflix sued for defamation by writer depicted in Anna Delvey ...,0.0
2022-08-30,Netflix Sued by Former Vanity Fair Staffer Over ‘Inventing Anna’ Portrayal,0.35
2022-08-30,'Inventing Anna': Rachel Williams Sues Netflix for Making Her ...,0.0
2022-08-30,43 new Netflix movies arrive before year's end — see the list,0.13636363636363635
2022-08-30,Netflix Poaches Snapchat Execs Jeremi Gorman and Peter Naylor to Lead Advertising Business,0.0
2022-08-30,"New On Netflix September 2022: 'Blonde,' 'Cobra Kai' And More",0.21212121212121213
2022-08-30,Here's how much Netflix's ad-supported tier may cost at ...,0.2
2022-08-30,"Netflix’s Quality Control Problem Is Getting Worse, Not Better",-0.325
2022-08-30,"Netflix Reveals First DVD It Ever Shipped, Asks Users To Share Ones They ‘Forgot’ To Return",0.25
2022-08-31,"Finally, some details on Netflix’s ad-supported offering — but buyers are stunned at what they’re hearing",0.0
2022-08-31,What's Leaving Netflix September 2022? Movie & Show Removals,0.0
2022-08-31,"New on Netflix September 2022: Movies, Shows to Stream",0.13636363636363635
2022-08-31,Here's What's Leaving Netflix In September 2022,0.0
2022-08-31,Rachel DeLoache Williams sues Netflix over 'dishonest ...,-0.3
2022-08-31,Netflix and the International Sámi Film Institute Enter Into a ...,0.0
2022-08-31,"'Lord of the Rings', 'Star Wars', 'Cobra Kai': 8 highly-anticipated shows streaming on Amazon, Disney+, Netflix, Hulu in September",0.0
2022-08-31,Derry Girls' Last Season Finally Has a Premiere Date on Netflix,0.0
2022-08-31,Netflix hires show streamer is 'serious about ramping up ad efforts': analyst,-0.3333333333333333
2022-08-31,I Came By review - is Line of Duty star's Netflix film any good?,0.7
2022-09-01,The 6 most anticipated releases on Netflix France in September 2022,0.5
2022-09-01,The 15 best films coming to Netflix in September 2022,1.0
2022-09-01,Best Movies Coming to Netflix in September: 'Road House ...,1.0
2022-09-01,"Netflix agrees to give Iñárritu's new movie, ‘Bardo,’ a first run in U.S., Mexican theaters",0.12878787878787878
2022-09-01,Iñárritu on ‘Bardo’: Netflix’s Theatrical Run Is an ‘Exceptional Gesture’ but Streaming Is a ‘Prevailing Tide’,0.3333333333333333
2022-09-01,Adam Driver's Netflix movie White Noise gets strong first reviews,0.22777777777777777
2022-09-01,"Ads on Netflix: They’re Gonna Be Expensive, with Limited Choices for Advertisers",-0.2857142857142857
2022-09-01,"'Mo' than just a show, Netflix's TV series receives rave reviews",0.0
2022-09-01,Netflix is starting to look more like traditional TV,0.16666666666666666
2022-09-01,Love in the Villa review – immediately forgettable Netflix romcom,0.0
2022-09-02,Netflix’s cheaper ad tier could arrive earlier than expected,-0.05
2022-09-02,Netflix With Ads Will Reportedly Launch on Nov. 1,0.0
2022-09-02,Netflix's Ad-Supported Subscription Plan Expected to Launch ...,-0.1
2022-09-02,Why is 'Blonde' – Netflix's Marilyn Monroe biopic – rated NC-17 instead of TV-MA?,0.0
2022-09-02,European Producers Club and Netflix Reveal the Winners of ...,0.0
2022-09-02,Netflix teases Johnny Manziel project with short clip,0.0
2022-09-02,Netflix Animation Foundation Program Partners With Black 'N ...,-0.16666666666666666
2022-09-02,Meet The Cast Of Netflix's 'Dated & Related'—See Their ...,0.0
2022-09-02,Netflix Drama ‘The Crown’ Finds Its William And Kate: Two Actors To Play Prince & Newcomer Cast As Kate Middleton In Season 6,0.0
2022-09-02,"New Movies and Shows on Netflix: September 2nd, 2022",0.06818181818181818
2022-09-03,Netflix to Roll Out New Ad-Supported Plan Later This Year,0.06818181818181818
2022-09-03,‘Echoes’ Dethroned In Netflix’s Top 10 List By A New Show,0.3181818181818182
2022-09-03,Netflix's BioShock movie takes exciting step forward,0.3
2022-09-03,ExpressBasics: Sharing Netflix? How to lock your profile for privacy,0.0
2022-09-03,"Netflix, HBO, Comcast Make a Huge Streaming Mistake",0.4000000000000001
2022-09-03,Sex/Life season 2 is not coming to Netflix in September 2022,0.0
2022-09-03,List of Netflix's top 10 trending movies and TV shows,0.5
2022-09-04,"‘True, apart from the made-up bits’: why people are lining up to sue over Netflix portrayals",0.35
2022-09-04,Vampire Diaries Is No Longer on Netflix — Here's Where You Can Stream It Now,0.0
2022-09-04,Can I still rent DVDs from Netflix?,0.0
2022-09-04,New Documentary About Historic 1983 America’s Cup To Debut On Netflix,0.04545454545454545
2022-09-04,Netflix Added 79 New Movies and Shows on Netflix This Week,0.13636363636363635
2022-09-04,Netflix still has a DVD business 25 years later. Here's what it's like,0.0
2022-09-04,‘Copenhagen Cowboy’ Trailer: Nicolas Winding Refn Returns to Denmark with Stylish Netflix Series,0.5
2022-09-04,French Bid to Counter Netflix Threat Falters on Antitrust Rules,0.0
2022-09-04,Netflix documentary - ‘The Rise and Fall of AND1’ - What happened to the street basketball brand?,0.0
2022-09-04,Netflix Top 100: 'The Sandman' and 'Me Time' Biggest Titles ...,0.5
2022-09-05,Netflix bans crypto commercials on ad-based streaming service: Report,0.0
2022-09-05,Netflix’s ‘Devil In Ohio’ Is Not Worth Your Time,-0.15
2022-09-05,Netflix top 35 movies to watch this September. Check out the full list here,0.425
2022-09-05,Me Time viewers extremely divided over Netflix's new Kevin Hart and Mark Wahlberg film - here's why,0.005681818181818177
2022-09-05,83 Movies and TV Shows Leaving Netflix Canada in October ...,0.0
2022-09-05,Netflix vs. Apple TV+: Which Streaming Service Should You ...,0.0
2022-09-05,Phoenix chef to be featured on Netflix show,0.0
2022-09-05,Shows like Echoes on Netflix: Here's what to watch next,0.0
2022-09-05,Schitt's Creek is leaving Netflix — you've only got four weeks ...,0.0
2022-09-05,"After his Prime Video debacle, Nicolas Winding Refn and ...",0.0
2022-09-06,Gulf states demand Netflix pull content deemed offensive,0.0
2022-09-06,Netflix: Gulf states demand removal of 'offensive' content,0.0
2022-09-06,Gulf Arab nations ask Netflix to remove 'offensive' videos,0.0
2022-09-06,Netflix Settles ‘Queen’s Gambit’ Defamation Suit Brought by Georgian Chess Grandmaster,0.0
2022-09-06,A Chess Champion Resolves Her ‘Queen’s Gambit’ Lawsuit Against Netflix,0.0
2022-09-06,‘Queen’s Gambit’ Defamation Suit Against Netflix Over ‘Sexist’ Series Is Settled,0.0
2022-09-06,Mila Kunis’ Dark Past Returns With a Vengeance in Netflix’s ‘Luckiest Girl Alive’ Trailer,-0.10000000000000002
2022-09-06,What To Know About The Cult In Netflix’s ‘Devil In Ohio’,0.0
2022-09-06,"Netflix signs deal with Indonesia to boost cinema, tourism",0.0
2022-09-06,Mo On Netflix Is An Unlikely— And Radical— Hit Series,0.0
2022-09-07,Gulf states warn Netflix of legal action over 'un-Islamic' content,0.15000000000000002
2022-09-07,Gulf nations demand Netflix remove ‘offensive’ content,0.0
2022-09-07,Saudi Arabia and Gulf neighbors threaten Netflix over content that 'violates Islamic values',0.0
2022-09-07,"Netflix Hunts for Cost Cuts, From Cloud Computing to ...",0.0
2022-09-07,‘Eh-oh!’: Teletubbies to return on Netflix as series reboots for streaming,0.0
2022-09-07,Sony’s flopped ‘Morbius’ movie is coming to Netflix,0.0
2022-09-07,Netflix settles ‘Queen’s Gambit’ defamation suit brought by Soviet chess grandmaster,0.0
2022-09-07,Netflix has big plans for popular children's show 'CoComelon',0.3
2022-09-07,Time to binge-watch! Best shows on Netflix this September. Here's a full list,0.675
2022-09-07,"Latest OTT releases on Netflix, Disney+ Hotstar, Zee5, and Amazon Prime this week: Here's a complete list",0.3
2022-09-08,What Time Will 'Cobra Kai' Season 5 be on Netflix?,0.0
2022-09-08,‘Glass Onion: A Knives Out Mystery’ Trailer Teases New Rian Johnson-Daniel Craig Murder Mystery for Netflix,0.13636363636363635
2022-09-08,‘Glass Onion’ Trailer: ‘Knives Out’ Sequel Promises a Puzzling New Mystery,0.13636363636363635
2022-09-08,‘Teletubbies’ reboot with Tituss Burgess is headed to Netflix,0.0
2022-09-08,"The Best New Movies And Shows On Netflix Today: September 8, 2022",0.5681818181818181
2022-09-08,Comedian and Netflix star David A. Arnold dead at 54,-0.2
2022-09-08,"The Good Nurse: Netflix release date, cast and trailer for ...",0.7
2022-09-08,"Netflix's ""Mo"" depicts quintessential Houston",0.0
2022-09-08,‘End of the Road’ Review: Queen Latifah and Ludacris Take a Detour in Lackluster Netflix Thriller,0.0
2022-09-08,"Omar Sy in Talks to Star in Netflix ‘Yasuke’ Event Series From 21 Laps, Significant Productions (Exclusive)",0.375
2022-09-09,Concern Raised Over Censorship Threat Against Netflix ...,0.0
2022-09-09,Here's What Blonde's NC-17 Rating Means | Time,0.0
2022-09-09,"Netflix is no longer going to let you binge on your new shows, here's what we know",0.13636363636363635
2022-09-09,"Netflix's The Crown set to suspend production, events ...",0.0
2022-09-09,‘Cobra Kai’ Season 5 Looks To Snap Netflix’s Streak Of #1 Losers,-0.2
2022-09-09,End of the Road review – Queen Latifah finds a dead end in clumsy Netflix thriller,-0.25
2022-09-09,"The Best New Movies And Shows On Netflix Today: September 9, 2022",0.5681818181818181
2022-09-09,Take a Tour of ‘the Watcher’ House in Clever Teaser for Netflix Limited Series,0.047619047619047616
2022-09-09,"The King's Horseman, Nigeria's most famous play, is now a Netflix movie: what makes it a classic",0.3888888888888889
2022-09-09,Sony deal paying off: 'Morbius' is Netflix's top movie in the US,0.5
2022-09-10,Netflix Is Helping Make A New Assassin's Creed Game,-0.13181818181818183
2022-09-10,Netflix and Ubisoft Announce Three Exclusive Mobile Games ...,0.0
2022-09-10,Netflix to get mobile Assassin's Creed and two other Ubisoft ...,-0.125
2022-09-10,‘Devil In Ohio’ Dethroned In Netflix’s Top 10 By A New Show,0.3181818181818182
2022-09-10,"No, Netflix Isn't Ditching The Binge Release Format",0.0
2022-09-10,Netflix's 'End of the Road' is a tense social thriller that finds ...,-0.15
2022-09-10,Can Netflix Regain Its Growth Stock Status?,0.0
2022-09-10,'Fargo' Series Leaving Netflix in October 2022,0.0
2022-09-10,How Netflix and Amazon Prime Video are revolutionizing ...,0.0
2022-09-10,New Netflix series features a chupacabra as the ‘Terror of Tacoma’,0.13636363636363635
2022-09-11,Netflix partners with Ubisoft to bolster fledgling gaming division,0.0
2022-09-11,Queen Elizabeth’s Death Has ‘The Crown’ Surging In Popularity On Netflix,0.0
2022-09-11,‘Cobra Kai’ Season 5 Is Netflix’s Best-Reviewed Show Since ‘Heartstopper’,0.0
2022-09-11,The Best New Movies And Shows To Stream On Netflix ...,0.5681818181818181
2022-09-11,'The Crown' Surges in Popularity on Netflix Following Queen ...,0.0
2022-09-11,What's Coming to Netflix This Week: September 12th to 18th ...,0.0
2022-09-11,New Tyler Perry Film 'A Jazzman’s Blues' Will Stream On Netflix,0.13636363636363635
2022-09-11,Netflix drama I Came By: The ending explained,0.0
2022-09-12,Netflix to Bolster Gaming Division with Ubisoft Partnership ...,0.0
2022-09-12,"Netflix Movie Knives Out 2 Is Meant To Be Seen In A Theater, Director Says",0.0
2022-09-12,"Blonde Netflix review: No one is ready for the explicit, relentless brutality of the Marilyn Monroe biopic",0.1
2022-09-12,‘The Crown’ Viewing on Netflix Surges After Queen Elizabeth II’s Death,0.0
2022-09-12,Daredevil: Born Again Won't Be a Continuation of the Netflix ...,0.0
2022-09-12,Snowman launches its latest game Lucky Luna exclusively with Netflix,0.14444444444444443
2022-09-12,How to Become a Netflix Dubbing Provider,0.0
2022-09-12,"Netflix Top 10 Shows and Movies: New and Trending Today, September 12",0.3181818181818182
