날짜,뉴스,점수
2021-11-03,Sofia Vergara to Star in ‘Griselda’ Limited Series at Netflix From ‘Narcos’ Team,-0.07142857142857142
2021-11-03,Netflix Orders 'Griselda' Limited Series From Narcos Creator ...,-0.07142857142857142
2021-11-04,Netflix branches into video games - GameDaily.biz | We Make ...,0.0
2021-11-04,"Netflix talks 'Squid Game' creator compensation, working with ...",-0.4
2021-11-04,"Best non-English, foreign-language shows to watch on Netflix",1.0
2021-11-04,How Foreign-Language Shows Such as Squid Game Are ...,-0.2
2021-11-04,Netflix digs in and says little about network usage payments,-0.1875
2021-11-04,New Idris Elba Movie Quickly Conquers Netflix Charts,0.23484848484848483
2021-11-04,"Regina King, David E. Kelley Team for Netflix Series",0.0
2021-11-04,Netflix Orders New Mo Amer Stand-Up Special and Scripted Comedy Series (EXCLUSIVE),0.24675324675324675
2021-11-04,Netflix's Red Notice Rotten Tomatoes Score Is Out,0.0
2021-11-04,Is new Netflix film Army of Thieves worth the watch?,0.21818181818181817
2021-11-05,Netflix’s mobile games for Android users: Here’s how it works,0.0
2021-11-05,Sofia Vergara to play 'cocaine queen' Griselda Blanco in Netflix show,0.0
2021-11-05,Love Hard review: Catfish romcom delivers a sleigh-full of ...,0.10416666666666666
2021-11-05,7 Best New Shows on Netflix in November 2021,0.5681818181818181
2021-11-05,"Netflix’s Harder They Fall, Finch, and the 9 new movies to watch",0.018181818181818174
2021-11-05,'Harder They Fall' ending explained: Netflix twist is personal,-0.05
2021-11-05,Colin Kaepernick shares his truth on Netflix in a way you ...,0.0
2021-11-05,'Army of the Dead' Re-emerges on Netflix Top 10s Following ...,0.09999999999999999
2021-11-05,Netflix shares mum and baby throwback of 'Maid' stars ...,0.0
2021-11-05,Why Suits Against Netflix Could Shake Streaming,0.0
2021-11-06,Netflix and Dave Chappelle aren't getting 'canceled',0.0
2021-11-06,Arcane review: League of Legends’ best story ever is now on Netflix,1.0
2021-11-06,'Arcane' is a new breed of mature animation for the Netflix gaming crowd,0.11818181818181818
2021-11-06,The new Netflix series 'Arcane' expands 'League of Legends ...,0.13636363636363635
2021-11-06,Richard Ashcroft claims Netflix wants to make docudrama ...,0.2
2021-11-06,'Love Hard': Worst moments in the Netflix holiday movie,-0.2638888888888889
2021-11-06,Narcos Mexico end | why has Netflix series ended?,0.0
2021-11-06,Nigerian Influences In New Netflix Hit Movie 'The Harder They ...,0.018181818181818174
2021-11-06,New Netflix Animated Series Dethrones You & Squid Game as Top TV Show,0.07878787878787878
2021-11-06,7 Best New Movies on Netflix in November 2021,0.5681818181818181
2021-11-07,Netflix to release games via App Store instead of through streaming app,0.0
2021-11-07,Netflix's 'The Harder They Fall' is a fictional tale about very real ...,0.05333333333333334
2021-11-07,How to set viewing restrictions on Netflix via parental controls,0.0
2021-11-07,Exclusive: Bay Area rapper Too Short stands by Dave Chappelle amid Netflix controversy,0.0
2021-11-07,Where to watch Dexter: Is it on Netflix?,0.0
2021-11-07,What time is Passing coming to Netflix?,0.0
2021-11-08,Apple Complicates Netflix Gaming Push,0.0
2021-11-08,Riot Games TV gamble on 'League of Legends' Netflix series,0.0
2021-11-08,Who is Vander in Netflixs Arcane? Is he a character from the League of Legends games?,0.0
2021-11-08,Arcane reaches top spot on Netflix in 38 countries,0.5
2021-11-08,Ryan Reynolds Says He Wasted Millions Of Netflix Money On ...,-0.2
2021-11-08,Why Netflix's Narcos Mexico season 4 was cancelled,0.0
2021-11-08,What Netflix's Entrance In Gaming Means For Big And Small Gamers Alike,-0.125
2021-11-08,"The Splendid Uncoolness of “Sex, Love & Goop”",0.6666666666666667
2021-11-08,'Shadow and Bone' Season 2 Reportedly Starts Filming in ...,0.0
2021-11-08,'Love Hard' Netflix: The Surprise Ending Explained,0.10416666666666666
2021-11-09,Tiger King 2: Carole Baskin has 'no claim' to sue over footage - Netflix,0.0
2021-11-09,Netflix launches games to iPhone and iPad users worldwide,0.0
2021-11-09,Netflix Gaming is rolling out on iPhone and iPad,0.0
2021-11-09,"‘Arcane’ Is Netflix’s Best Rated Original Series Ever, According To IMDB",0.6875
2021-11-09,Netflix's new short video strategy could prove Quibi was right,0.14069264069264067
2021-11-09,Squid Game: Hit Netflix show officially coming back for season two,-0.2
2021-11-09,"Netflix, Please Add a ‘Watched It’ Button Already",0.0
2021-11-09,Netflix Unveils First Members of Live-Action 'One Piece' Cast,0.25
2021-11-09,"Netflix Unveils Huge Expansion of Japanese Content, Greater Emphasis on Feature Films",0.30000000000000004
2021-11-09,Netflix's Live-Action Gundam Movie First Look,0.25
2021-11-10,Main Cast Announced For Netflix's Live-Action One Piece Series,0.16666666666666666
2021-11-10,"The Devastating Ending Of Netflix's Passing, Explained",-1.0
2021-11-10,"In Netflix's 'Passing,' Tessa Thompson and Ruth Negga play ...",0.0
2021-11-10,Passing Cast: Where You've Seen The Netflix Movie Actors ...,0.0
2021-11-10,We played the Netflix mobile games and they're the least bit exciting,0.0
2021-11-10,Netflix Australia plans: Price increase on standard and premium rolled out from November 11,0.0
2021-11-10,‘SNL’s’ Kyle Mooney to Parody ’80s Cartoons for Netflix,0.0
2021-11-10,Who Does Natalie End Up With In Netflix’s Love Hard?,0.10416666666666666
2021-11-10,Holiday Rom-Com Movie 'A Castle for Christmas' is Coming to ...,0.0
2021-11-10,New Netflix Christmas film features a star cast – and York!,0.17045454545454544
2021-11-11,Netflix rolls out AV1 streaming for smart TVs and PlayStation 4 Pro - GSMArena.com news,0.21428571428571427
2021-11-11,"The Devastating Ending Of Netflix's Passing, Explained",-1.0
2021-11-11,10 Best Movies Like Netflix's Passing,1.0
2021-11-11,‘Red Notice’ Is Yet Another Poor Attempt at a Netflix Movie Franchise,-0.2
2021-11-11,Netflix hikes up costs for Aussie subscribers,0.0
2021-11-11,Netflix is closing in on Disney again in terms of market value | Mint,0.0
2021-11-11,Here's how to unlock Netflix's hidden video games,-0.16666666666666666
2021-11-11,Netflix releases details on David Fincher-produced film essay ...,0.0
2021-11-11,Netflix prices up 15%: 4 ways to cut your bill and have more to watch,0.5
2021-11-11,"Netflix, HBO, Amazon Buying Up Reality TV Shows for ...",0.0
2021-11-12,Red Notice: Netflix Has Made Another Chore of a Blockbuster,0.0
2021-11-12,Here are 12 action flicks better Netflix's 'Red Notice',0.19999999999999998
2021-11-12,Cinemark Announces Red Notice is Exhibitor's Best ...,0.5
2021-11-12,Netflix brings high-efficiency AV1 streams to TVs for the very ...,0.2
2021-11-12,Passing Netflix movie: How the adaptation differs from Nella ...,0.0
2021-11-12,Netflix show 'Uncoupled' cuts a Latina housekeeper character that was criticized as offensive,0.0
2021-11-12,Netflix launches Free Plan in Vietnam,0.4
2021-11-12,Netflix’s ‘Crime Scene’ Doc Series Scores 3-Season Renewal,0.0
2021-11-12,"What's Trending on Netflix This Week: November 12th, 2021",0.0
2021-11-12,BT TV adds Netflix to its flexible TV packages,0.0
2021-11-13,"'Crime Scene' Renewed at Netflix for 3 More Seasons, Will ...",0.5
2021-11-13,Red Notice has Netflix's Biggest Opening Day for a Film,0.0
2021-11-13,23 Most Charming Netflix Thanksgiving Shows And Movies,0.6
2021-11-13,Crítica: Alerta Vermelho - ★★★☆☆ (2021),0.0
2021-11-14,Netflix Red Notice is what happens when AI dictates creative ...,0.25
2021-11-14,Royal family told they can sue Netflix over hit series The Crown,0.0
2021-11-14,Kick Off Christmas Season With Netflix's 'Love Hard',0.10416666666666666
2021-11-14,‘Insiders’ Pushes the Netflix Reality Show Line One Step Further,0.0
2021-11-14,'Halt and Catch Fire' Leaving Netflix in December 2021,0.0
2021-11-14,"Michael Che talks ‘SNL’, new Netflix special, and using humor through hardship",0.24675324675324675
2021-11-14,"Jeu vidéo : avec Netflix Games, Netflix veut sa part du gâteau",0.0
2021-11-14,CuriosityStream Stock: Emulating The Success Of Netflix ...,0.3
2021-11-14,10 Best Shows Like Netflix's Gentefied,1.0
2021-11-14,Comment regarder Netflix à la télé sans Smart TV ?,0.21428571428571427
2021-11-15,Cowboy Bebop review: Netflix reduces a classic anime to a wacky cartoon,0.3333333333333333
2021-11-15,"Netflix's Cowboy Bebop has heart, style, and some rough edges",-0.1
2021-11-15,The Missing Spirit of Netflix’s ‘Cowboy Bebop’,-0.2
2021-11-15,Get a First Look at Netflix's Heartwarming New Series Twentysomethings: Austin,0.19318181818181818
2021-11-15,Ryan Reynolds pays tribute to Wrexham in hilarious new ...,0.3181818181818182
2021-11-15,Subscribe to Netflix and Spotify from your banking app? Discover the winning solution of the BBVA Hackathon,0.5
2021-11-15,"Watch English National Opera’s ‘TikTopera’ version of Netflix’s true crime documentary, Tiger King",0.11666666666666665
2021-11-15,Netflix's Love Hard Title Has A Secret Meaning Behind It,-0.1479166666666667
2021-11-15,Netflix Show Drops 'Hurtful and Derogatory' Latina Role from ...,0.0
2021-11-15,The Harder They Fall Proves Netflix Is The Future Of ...,0.06666666666666667
2021-11-16,Netflix trumpets top 10 lists based on new viewership metric,0.3181818181818182
2021-11-16,Netflix to Release Weekly Lists of Its Most-Watched Programs,0.0
2021-11-16,Netflix Changes How It Measures Its Daily Top 10,0.25
2021-11-16,"‘Squid Game’ Is Decisively Netflix No. 1 Show of All Time With 1.65 Billion Hours Streamed in First Four Weeks, Company Says",-0.07500000000000001
2021-11-16,Squid Game Just Smashed Another Huge Netflix Record,2.7755575615628914e-17
2021-11-16,Star Trek: Discovery Leaving Netflix Internationally For ...,0.0
2021-11-16,Netflix's 'Tiger King 2': Everything We Know So Far,0.1
2021-11-16,Netflix's Avatar is being shot on a Mandalorian-style virtual stage,0.0
2021-11-16,Netflix's 'Cowboy Bebop' Is the Rare Remake That Works,0.3
2021-11-16,Netflix to double size of Shepperton Studios base in boost for UK output,-0.4
2021-11-17,Netflix spills some details on hotly anticipated new reality show,0.19318181818181818
2021-11-17,"`It was on `You!`: News anchor fails to understand Netflix show reference on live TV, watch",-0.18181818181818182
2021-11-17,Netflix Website Promises More Specifics About Its 'Top 10' Lists,0.5
2021-11-17,Netflix's 'Gentefied' feels real because it's made by Latinx ...,0.2
2021-11-17,Star Trek Discovery season 4 launch pulled from Netflix,0.0
2021-11-17,Netflix Gets Last Laugh With Blockbuster Video Store Comedy Series Starring Randall Park,0.15
2021-11-17,Ryan Reynolds releases his new Netflix movie with Welsh ...,0.13636363636363635
2021-11-17,Netflix ha lanzado la web que visitarás cuando no sepas qué ver,0.0
2021-11-17,Netflix Cancels YA Skating Drama ‘Zero Chill’ After One Series,0.0
2021-11-17,"Tiger King 2, Netflix — the improbably successful ...",0.75
2021-11-18,"Hellbound review: Netflix, Train to Busan director take on God",0.0
2021-11-18,"Tiger King 2 on Netflix peers into Joe Exotic's cage, finds very little",0.128125
2021-11-18,‘Tiger King’ Season 2: Ugly Villainy Dominates Netflix’s Shameless Double Down on Joe Exotic Saga,-0.08888888888888888
2021-11-18,"Everything You Need to Know for Netflix's tick, tick...BOOM!",0.0
2021-11-18,"The Princess Switch 4 on Netflix release date, cast, plot",0.0
2021-11-18,Netflix Top 10 website to publish list of most popular titles ...,0.5333333333333333
2021-11-18,What to Know About Cowboy Bebop Ahead of Netflix Adaptation,0.0
2021-11-18,HBO discussed buying Netflix in 2006,0.0
2021-11-18,"TV Ratings: K-Dramas, ‘Seinfeld’ and ‘You’ Dominate Netflix",0.0
2021-11-18,Netflix’s ‘Lupin’ Part 3 Now Filming in Paris,0.0
2021-11-19,Netflix's 'Cowboy Bebop' reignites a debate: Is Jet Black a ...,-0.16666666666666666
2021-11-19,Netflix reboots 'Cowboy Bebop' starring John Cho,0.0
2021-11-19,Cowboy Bebop: Faye Valentine Is Queer in Netflix Series,0.0
2021-11-19,"Tick, Tick, Boom: All the Broadway cameos in the Netflix ...",0.0
2021-11-19,Netflix and Movie Musicals: It's Complicated,-0.5
2021-11-19,Lin-Manuel Miranda's New Movie Debuts on Netflix,0.13636363636363635
2021-11-19,Procession: Netflix's Catholic abuse documentary gives ...,0.0
2021-11-19,Tiger King season 3 release date rumours: Will the Netflix ...,0.0
2021-11-19,Netflix to reveal viewing numbers of popular shows for the first time,0.425
2021-11-19,"What's New on Netflix & Top 10s: November 19th, 2021",0.3181818181818182
2021-11-20,15 details you missed in Netflix's 'Cowboy Bebop' reboot,0.0
2021-11-20,‘Arcane’ Renewed for Season 2 by Netflix,0.0
2021-11-20,‘Arcane’ Renewed For Season 2 By Netflix,0.0
2021-11-20,"Netflix's Hellbound is a Brutal, Thrilling Series About Belief ...",-0.3125
2021-11-20,Netflix Launches Top 10 Website With Popular TV & Films,0.55
2021-11-20,Squid Game Falls Out of Netflix Top 10 for First Time,0.11666666666666665
2021-11-20,Watch out for these Netflix scams that are running rampant ...,0.0
2021-11-21,Arcane season 2 officially coming to Netflix,0.0
2021-11-21,Netflix releases weekly list of top shows by viewing hours,0.5
2021-11-21,15 Shows Like Maid to Watch If You Love Netflix's Acclaimed ...,0.5
2021-11-21,Red Notice Holds Off Multiple New Series for Top Netflix Spot,0.1590909090909091
2021-11-21,‘Christmas Flow’ On Netflix: New French Romantic Comedy For The Holidays,0.04545454545454545
2021-11-21,10 Netflix Series You Should Watch If You Love Money Heist,0.5
2021-11-21,When Will We Get A Christmas Prince 4 On Netflix?,0.0
2021-11-21,"Netflix : ""Octobre"", la très bonne série éclipsée par le succès ...",0.0
2021-11-21,Cómo descargar cualquier idioma en Google Translate,0.0
2021-11-22,S. Korean series “Hellbound” outdoes “Squid Game” to top ...,0.04999999999999999
2021-11-22,Kevin Spacey ordered to pay 'House of Cards' studio nearly $31 million for contract breach,0.1
2021-11-22,"Terra Field, Netflix Employee Who Criticized Chappelle Special, Resigns",0.35714285714285715
2021-11-22,Red Notice is a huge hit for Netflix. But what does that actually ...,0.13333333333333336
2021-11-22,"Netflix to Acquire Scanline VFX, Effects Studio That Has Worked on ‘Stranger Things,’ ‘Cowboy Bebop,’ ‘Eternals’ and More",0.5
2021-11-22,‘Inventing Anna’: Watch the Trailer for Shonda Rhimes’ Next Netflix Show,0.0
2021-11-22,‘Nocterra’ Series Based on Image Comics Title in the Works at Netflix,0.0
2021-11-22,New reality show 'Selling Tampa' is coming to Netflix on Dec. 15,0.13636363636363635
2021-11-22,Netflix Thriller ‘The Night Agent’ Finds Its Two Leads,0.0
2021-11-22,"What's New on Netflix & Top 10s: November 22nd, 2021",0.3181818181818182
2021-11-23,Spotify collaborates with Netflix to launch new dedicated Netflix Hub - GSMArena.com news,0.13636363636363635
2021-11-23,"Get Even More 'Squid Game,' 'Bridgerton,' and 'Money Heist ...",0.04999999999999999
2021-11-23,Spotify debuts a ‘Netflix Hub’ featuring music and podcasts tied to Netflix shows and movies,0.0
2021-11-23,"Trans Netflix workers drop labor complaint, but 1 resigns after ...",-0.3
2021-11-23,Dave Chappelle Netflix documentary: Consequences and backlash after 'The Closer',0.0
2021-11-23,Arcane Renewed for a Second Season at Netflix,0.0
2021-11-23,"John Cho on Netflix's ‘Cowboy Bebop’ remake, his ‘most intense job’ yet",0.35
2021-11-23,‘Hellbound’: Netflix’s Latest Korean Blockbuster Series Is Aimed at Your Soul,0.5
2021-11-23,What's coming to Netflix in December 2021 | EW.com,0.0
2021-11-23,Netflix's 'Cowboy Bebop' is everything wrong with nostalgia reboots,-0.5
2021-11-24,Selling Tampa cast: Meet the ladies of Netflix's new real estate ...,0.16818181818181818
2021-11-24,‘True Story’ Review: Kevin Hart and Wesley Snipes Are Brothers in Predictable Netflix Fable,0.07499999999999998
2021-11-24,Marvel star makes surprise cameo in Netflix's True Story as ...,0.35
2021-11-24,"What's New on Netflix & Top 10s: November 24th, 2021",0.3181818181818182
2021-11-24,'Red Notice' On Track To Be Netflix's Most Watched Movie Of ...,0.25
2021-11-24,India's OTT revenue to reach $4.5bn by 2026; Netflix ahead in ...,0.0
2021-11-24,Korean drama Hellbound overtakes Squid Game as most popular Netflix show - all the details,0.2333333333333333
2021-11-24,Sandra Bullock in Netflix’s ‘The Unforgivable’: Film Review,0.0
2021-11-24,Here Comes the Boom: The #2 movie on Netflix is so terrible,-1.0
2021-11-24,9 Spectacular Shows Appearing On Netflix December 2021 ...,0.6
2021-11-25,"Netflix's 'True Story' review, trailer: Wesley Snipes and Kevin Hart's new drama",0.24318181818181817
2021-11-25,How Well Has 'Arcane' Done on Netflix? All The Stats So Far,0.1
2021-11-25,Bruised review: Halle Berry’s Netflix movie isn’t worthy of her talent,0.3333333333333333
2021-11-25,Netflix acquires Scanline VFX,0.0
2021-11-25,Zack Snyder's 'Planet of the Dead' on Netflix: Everything We ...,-0.2
2021-11-25,Netflix slow? Here is how you can confirm Netflix streaming speed in the app,-0.30000000000000004
2021-11-25,"Italy Is Piloting Its Own ‘Netflix for Culture’ for Art Shows and Performances, in Hopes of Helping Struggling Institutions Stay Afloat",0.3
2021-11-25,"'Longmire' Could Soon Be Leaving Netflix, Here's Why",0.0
2021-11-25,"Stream It Or Skip It: 'Super Crooks' on Netflix, A Teen-With-Powers Cartoon That Promises A Bad Attitude",-0.18333333333333326
2021-11-25,18 uplifting movies on Netflix for a feel-good escape,0.0
2021-11-26,Hellbound beat Squid Game to become Netflix's most watched ...,0.04999999999999999
2021-11-26,Russia investigates complaint against Netflix over LGBT content,-0.3
2021-11-26,"Arcane review: A great Netflix show, even if League of Legends isn’t your thing",0.8
2021-11-26,What's Happening With Netflix's Gorillaz Movie? Damon ...,0.0
2021-11-26,Who was Birgit Meier? Past life explored ahead of Netflix's 'Dig Deeper: The Disappearance of Birgit Meier' premiere,-0.25
2021-11-26,'First Ascent' Everything We Know About Daisy Ridley's New ...,0.19318181818181818
2021-11-26,Has Selling Sunset sold out? Inflated drama has ruined ...,0.0
2021-11-26,These three new Netflix shows all have perfect Rotten ...,0.5681818181818181
2021-11-26,A Castle for Christmas ending explained: How does the Netflix Christmas movie end?,0.0
2021-11-26,"What's New on Netflix Canada This Week: November 26th, 2021",0.13636363636363635
2021-11-27,‘True Story’ On Netflix: A Review Of The New Riveting Limited Series,0.22873376623376623
2021-11-27,Netflix's Hellbound: Best Shows To Watch Next From The ...,0.5
2021-11-27,"16 best movies to watch on Netflix, HBO, Amazon before they leave (Nov 2021)",1.0
2021-11-27,Money Heist Season 5: When is Episode 5 released on Netflix?,0.0
2021-11-27,Netflix Reveals Its Top Ten Most Popular Movies Of All Time,0.4
2021-11-27,Is New Year’s Eve on Netflix?,0.13636363636363635
2021-11-27,Best New Movies on Netflix for Thanksgiving Weekend 2021,0.5681818181818181
2021-11-27,Crítica | Um Menino Chamado Natal,0.0
2021-11-28,"Stream It Or Skip It: 'Elves' On Netflix, A Danish Scarefest About Violent Elves Disturbing A Family's Christmas Vacation",-0.65
2021-11-28,10 best family Christmas movies on Netflix (2021),1.0
2021-11-28,Red Notice 2: Director Confirms Sequel Talks With Netflix But There's a Catch,0.0
2021-11-28,Netflix Animated Series Returns for Final Season,0.0
2021-11-28,What's Coming to Netflix This Week: November 29th to ...,0.0
2021-11-28,One of Kevin Costner's Most Underrated Westerns Coming to Netflix,0.5
2021-11-28,How many A Christmas Prince movies are there on Netflix?,0.5
2021-11-28,The Fastest: Inside Netflix's first Arabic-language reality series,0.25
2021-11-28,Is Just Friends on Netflix?,0.0
2021-11-29,True Story on Netflix - Ending explained of Kevin Hart drama,0.35
2021-11-29,Will there be a second season of True Story on Netflix?,0.175
2021-11-29,Who Is Simone In Netflix’s 'True Story'?,0.35
2021-11-29,'The Power of the Dog' review: What it's about and where you ...,0.0
2021-11-29,Red Notice sets Netflix viewing record,0.0
2021-11-29,What's Coming to and Leaving Netflix in December 2021,0.0
2021-11-29,SNL star Kyle Mooney spoofs Saturday morning cartoons in ...,0.0
2021-11-29,Scots react to Netflix festive film A Castle for Christmas with scathing reviews,-0.6
2021-11-29,Millie Bobby Brown's 'The Girls I've Been' Netflix Thriller ...,0.0
2021-11-29,"Stream It Or Skip It: '14 Peaks: Nothing Is Impossible' on Netflix, The Story of One Man's Quest To Conquer The World's Greatest Peaks In Record Time",0.16666666666666669
2021-11-30,Bella Ciao! ‘Money Heist’ Fan Favorite ‘Berlin’ Is Getting His Own Spinoff Series at Netflix,0.55
2021-11-30,"After Success of ‘Bruised,’ Halle Berry and Netflix Team to Make More Movies",0.4
2021-11-30,Halle Berry Inks Multi-Film Partnership With Netflix,0.0
2021-11-30,Halle Berry Strikes Multi-Picture Deal With Netflix As Directorial Debut ‘Bruised’ Hits #1 In U.S.,0.0
2021-11-30,Netflix Announces A Slew Of New Series And More Details On ...,0.3181818181818182
2021-11-30,Is The Kid in Netflix's True Story based on a real person?,0.275
2021-11-30,MrBeast 'Squid Game' Sets Compared With Netflix Show,-0.4
2021-11-30,What's Coming to Netflix Canada in December 2021,0.0
2021-11-30,‘Red Notice’ Scores Top Slot on Netflix’s Film Chart for 3rd Week in a Row,0.16666666666666666
2021-11-30,Netflix Commissions Five UK Series: Rapman Superhero Show; ‘One Day’ Adaptation; Abi Morgan Thriller,0.0
2021-12-01,Netflix Shifts $100M to Black Banks to Close Equity Gap,-0.16666666666666666
2021-12-01,Lost In Space on Netflix: Will there be a season 4?,0.0
2021-12-01,'Lost in Space' blasts back onto Netflix today with Season 3,0.0
2021-12-01,Lost in Space review: Netflix’s Season 3 keeps a Star Trek dream alive,0.1
2021-12-01,Marvel's Benedict Cumberbatch is an unsettling terror in ...,-0.5
2021-12-01,"Guillermo del Toro Eager to Resurrect ‘Mountains of Madness’ at Netflix: ‘Smaller, Weirder’ Version",0.0
2021-12-01,New on Netflix: December 2021 Releases,0.13636363636363635
2021-12-01,'Red Notice' Takes 61% Third-Week Drop In Netflix Rankings,0.0
2021-12-01,"Top 9 shows on Netflix monthly ranking: 'Squid Game,' 'You'",0.04999999999999999
2021-12-01,Money Heist spin-off coming to Netflix in 2023,0.0
2021-12-02,Netflix developing a movie based on friendship that started from an accidental Thanksgiving invite,0.0
2021-12-02,Surprise! It Turns Out That 9 Netflix Christmas Movies Are Connected - Here's How,0.0
2021-12-02,A Guide To The Very Real And Legitimate Cinematic Universe ...,0.13
2021-12-02,"Streaming Christmas movie list 2021: Netflix, Disney+, HBO ...",0.0
2021-12-02,'Hellbound' is Netflix's latest Korean-language hit after 'Squid Game',0.04999999999999999
2021-12-02,'New Girl' Leaving Netflix Internationally in January 2022,0.06818181818181818
2021-12-02,Cowboy Bebop: Netflix's Live-Action Take Has a Vicious ...,-1.0
2021-12-02,'Single All the Way' Makes the Yuletide Gay in Netflix's Cheesy ...,-0.05158730158730159
2021-12-02,Halle Berry makes a deal with Netflix - Bizwomen,0.0
2021-12-02,Netflix releases interactive map of where Maid was filmed ...,0.0
2021-12-03,Netflix developing film about viral Thanksgiving grandma text,0.0
2021-12-03,Netflix greenlights movie about grandma's accidental Thanksgiving text to stranger,0.0
2021-12-03,How a grandma's accidental Thanksgiving text became a Netflix film,0.0
2021-12-03,Former Netflix engineer sentenced to prison for insider trading,0.0
2021-12-03,An Attempt to Make Sense of This Year's Netflix Christmas ...,0.0
2021-12-03,Saying goodbye to Money Heist: 5 things to know about the ...,0.0
2021-12-03,Antoine Fuqua Signs Netflix First-Look Film Deal Under New Banner Hill District Media (EXCLUSIVE),0.13636363636363635
2021-12-03,"Netflix Games: Nothing Netflix-y About It, Yet. OTT Giant Really Needs To Up Its Gaming Ante",0.1
2021-12-03,'Selling Sunset' Season 5 coming to Netflix in 2022,0.0
2021-12-03,"Netflix’s Power of the Dog, Spencer, and 10 new movies you can watch now",0.13636363636363635
2021-12-04,Former Netflix engineer and accomplice sentenced to prison for insider trading,0.0
2021-12-04,Gal Gadot’s Red Notice beats Bird Box to become Netflix’s biggest hit,0.0
2021-12-04,'Red Notice' is now Netflix's most-watched movie of all time,0.0
2021-12-04,‘Squid Game’ Stars Reflect on Dealing With Show’s Success: “It Was Hard to Follow”,-0.13055555555555556
2021-12-04,Disney's Streaming Budget Already Rivals That of Netflix,0.0
2021-12-04,Chris Hemsworth reveals two things are different in Netflix’s Extraction 2: ‘Tyler Rake lives’,0.0
2021-12-04,Best New Movies Added to Netflix This Week: December 4th ...,0.5681818181818181
2021-12-04,The Summit of the Gods review: Netflix’s intense manga adaptation is a trip,0.2
2021-12-04,‘Maid’ Star Margaret Qualley on Building Relationship With Child Actor Rylea Nevaeh Whittet: “We Were Really Glued Together”,0.2
2021-12-04,19 awesome Netflix movies to watch before the end of 2021,1.0
2021-12-05,'Red Notice' Is Netflix's Biggest Movie Ever. Critics Don't Get ...,0.0
2021-12-05,Three New Mobile Games Arrive on Netflix Globally,0.06818181818181818
2021-12-05,Former Netflix engineer sentenced to prison for insider trading scheme,0.0
2021-12-05,"What's Coming to Netflix This Week: December 6th - 12th, 2021",0.0
2021-12-05,Netflix’s ‘Voir’: TV Review,0.0
2021-12-05,7 New Netflix Shows in December and the Best Reasons to Watch,0.5681818181818181
2021-12-05,All the Vanessa Hudgens Christmas movies on Netflix,0.0
2021-12-05,Netflix's 'Single All the Way' review: Cheesy but vital,-0.15714285714285714
