날짜,뉴스,점수
2021-07-01,‘Fear Street’: How Netflix’s R-Rated Horror Trilogy Survived the Fox-Disney Merger,0.0
2021-07-01,My Perspective as a Sex Therapist on Netflix's 'Sex/Life',0.0
2021-07-01,"What's New on Netflix UK & Top 10s: July 1st, 2021",0.3181818181818182
2021-07-01,‘Beckett’ Trailer: John David Washington Runs for His Life in Netflix Political Thriller,0.0
2021-07-01,"Netflix's 'Audible': Nyle DiMarco, Matt Ogens on Making the Doc About a Deaf Athlete",0.0
2021-07-01,Netflix Introduces New Mobile Plan with Partial Download Feature,0.018181818181818174
2021-07-01,Netflix 'High on the Hog' explores shared Black food history,-0.003333333333333327
2021-07-01,Netflix Has Changed Storytelling. Here's What You Can Learn ...,0.0
2021-07-01,5 new Japanese films and series coming to Netflix in July 2021,0.06818181818181818
2021-07-01,How to lock your Netflix profile so no one else can see what you watch,0.0
2021-07-02,Vietnam orders Netflix to remove Australian spy show over ...,0.0
2021-07-02,"Netflix Cancels Four Comedies, Including ‘The Crew’",0.0
2021-07-02,Mr. Iglesias Not Returning for Season 3; Canceled at Netflix,0.0
2021-07-02,"Country Comfort, The Crew Among 4 Comedies Cancelled at Netflix",0.0
2021-07-02,New on Netflix in July 2021: Movies and Shows,0.13636363636363635
2021-07-02,Netflix's Fear Street Part 1: 1994: Shadyside Killers Explained,0.0
2021-07-02,Netflix On Nintendo Wii U And 3DS Is Officially Dead,-0.2
2021-07-02,Netflix’s ‘Masters of the Universe’ Reboot Releases Official Trailer,0.0
2021-07-02,‘Manifest’ Planted At #1 On Netflix As Fans Rally To Save It,0.0
2021-07-02,THE CRAVING – Netflix to Develop the Thriller with Some Serious Talent,-0.3333333333333333
2021-07-03,"Netflix Removed From Wii U And 3DS, Reminding Everyone ...",0.0
2021-07-03,It's A Bloodbath At Netflix As Mr. Iglesias And More Shows Get ...,0.5
2021-07-03,"25 years after 'Scream,' Netflix's 'Fear Street' trilogy reinvents ...",0.0
2021-07-03,Noah Centineo's Espionage Netflix Series: What We Know So ...,0.0
2021-07-03,5 best movies on Netflix to watch on Fourth of July weekend 2021,0.5
2021-07-03,"How To Watch Disney+, Prime Video, Netflix On Oculus Quest 2",0.0
2021-07-03,When will 'Bureau of Magical Things' Season 2 be on Netflix?,0.5
2021-07-03,5 best shows on Netflix for July 4th weekend 2021,1.0
2021-07-03,Ximena Lamadrid de ¿Quién Mató a Sara? visita La Paz y Los Cabos,0.0
2021-07-03,"Tak Melulu Dipaksa, Mereka Punya Alasan Menikah Segera",0.0
2021-07-04,Why Netflix's Fear Street Has an R-rating,0.0
2021-07-04,"What's Coming to Netflix This Week: July 5th to 11th, 2021",0.0
2021-07-04,How to delete all downloads on Netflix,0.0
2021-07-04,7 New Netflix Shows in July and the Best Reasons to Watch,0.5681818181818181
2021-07-04,Will Lucifer be renewed for season 7 on Netflix?,0.0
2021-07-04,Netflix's The Crown: why season 7 won't ever happen,0.0
2021-07-04,Netflix's Witcher Canon Explained: Do The Books & Video ...,0.0
2021-07-04,We The People: Everything you need to know about the ...,0.0
2021-07-04,The Internet Reacts to That Infamous Shower Scene in 'Sex/Life',-0.5
2021-07-04,"What's New on Netflix This Week: July 4th, 2021",0.13636363636363635
2021-07-05,Beast Wars battle back in new Netflix trailer for Transformers: War for Cybertron: Kingdom,0.06818181818181818
2021-07-05,"Netflix, Hulu, HBO Max: Watch what you like, if you can find it",0.0
2021-07-05,‘Manifest’ Could Become Netflix’s Most Popular Show Ever,0.55
2021-07-05,Netflix Buys ‘Tinder Swindler’ Documentary on Con Man Shimon Hayut (EXCLUSIVE),0.0
2021-07-05,Who is Moshow the Cat Rapper from Netflix's Cat People?,0.0
2021-07-05,Netflix cancelled 4 more TV shows last week – but none of our ...,0.25
2021-07-05,Netflix US removes ‘most popular movie’ since Top 10 ranking began,0.5333333333333333
2021-07-05,"Producers detail rising TV budgets for global Netflix, streaming shows",0.0
2021-07-05,Is Netflix's 'Fear Street' Trilogy Based on a Book?,0.0
2021-07-05,Cannes director criticises rivals for allowing Netflix movies in ...,0.0
2021-07-06,'Fear Street: 1994' Soundtrack - All The Songs from the Netflix ...,0.0
2021-07-06,"Naomi Osaka Confronts the Pressure to ""Maintain The Squeaky Image"" in First Trailer for Netflix Series",0.25
2021-07-06,Naomi Osaka Netflix Documentary: First Trailer,0.125
2021-07-06,Zack Snyder is working with Netflix on a space epic inspired by Star Wars,0.1
2021-07-06,‘The Witcher: Blood Origin’: Michelle Yeoh Cast As Scian In Netflix Prequel Series,0.0
2021-07-06,What's Coming to Netflix Australia in July 2021,0.0
2021-07-06,The shocking true story behind Netflix's Sophie: A Murder in West Cork,-0.35000000000000003
2021-07-06,Greg Berlanti & Sarah Schechter Form Movie Partnership With Netflix,0.0
2021-07-06,'Virgin River' Season 4 Begins Filming at End of July 2021,0.0
2021-07-06,See the First Trailer For Netflix's New Reality Show My Unorthodox Life,0.19318181818181818
2021-07-07,Netflix reuniting with Zack Snyder for Star Wars-inspired movie,0.0
2021-07-07,I Think You Should Leave Season 2 on Netflix: What will be ...,0.0
2021-07-07,Sex/Life ending explained: What happens and is the Netflix series based on a true story?...,0.35
2021-07-07,"Disney Streaming Division Hires Ex-Netflix Exec Ajay Arora to Lead Commerce, Experimentation Team",0.0
2021-07-07,Best Black Movies to Stream on Netflix in July,0.4166666666666667
2021-07-07,Netflix acquires French thriller 'The Stronghold' ahead of ...,0.0
2021-07-07,"Stream It Or Skip It: 'Cat People' On Netflix, About People Who Love Cats And What They Do To Show That Love",0.5
2021-07-07,What time is Virgin River season 3 released on Netflix?,0.0
2021-07-07,When will 'Grey's Anatomy' Leave Netflix?,-0.05
2021-07-07,'Emily's Wonder Lab' Season 2 Canceled at Netflix; Fans ...,0.0
2021-07-08,Shonda Rhimes Expands Netflix Deal,0.0
2021-07-08,Netflix Hires First Head of Podcasts: Former Apple and NPR Exec N’Jeri Eaton,0.125
2021-07-08,'Resident Evil: Infinite Darkness' Season 2: Netflix Renewal ...,-1.0
2021-07-08,New Netflix Reality Series ‘My Unorthodox Life’ Takes A Strong Stance Against Fundamentalism,0.2848484848484848
2021-07-08,Netflix: How to use the new ‘My List’ feature on your smartphone,0.13636363636363635
2021-07-08,Netflix rolls out release date for Red Notice its most expensive film EVER at '$200MILLION',0.0
2021-07-08,Viewers are saying the same thing about Netflix’s The Deceived,0.0
2021-07-08,What Time Will 'Virgin River' Season 3 Be on Netflix?,0.0
2021-07-08,Dueling Lakers Projects Set at Netflix and HBO in Ongoing Genre Wars,0.0
2021-07-08,"Uzo Aduba, Matthew Broderick to Star in Opioid Crisis Drama ‘Painkiller’ at Netflix",0.0
2021-07-09,Netflix’s Witcher anime has a new trailer and a release date,0.13636363636363635
2021-07-09,"The Witcher 3 PS5/Xbox Series X Still Coming In 2021, Adds Free Netflix DLC",0.4
2021-07-09,Netflix's The Witcher Reveals Season 2's First Major Monster,0.15625
2021-07-09,'Fear Street Part Two: 1978' Netflix Soundtrack - Full Song List,0.35
2021-07-09,When is Fear Street Part 3 coming to Netflix?,0.0
2021-07-09,5 Reasons Why You Should Watch Netflix's Fear Street Trilogy,0.0
2021-07-09,‘Cursed’ Canceled By Netflix After One Season,0.0
2021-07-09,5 reasons we're all watching 'Sex/Life' on Netflix,0.0
2021-07-09,"Netflix just made its clearest move yet pursuing VR, gaming",0.0
2021-07-09,I really need you to hear this - the new Resident Evil Netflix ...,-0.2212121212121212
2021-07-10,Witcher 3 is getting DLC inspired by the Netflix show,0.0
2021-07-10,Comcast's Peacock Just Dealt a Blow to HBO Max and Netflix,0.0
2021-07-10,Why 'Manifest' Season 4 Isn't Happening at Netflix,0.0
2021-07-10,Netflix's 'Fear Street' Trilogy: Is Shadyside a Real Place?,0.2
2021-07-10,'Virgin River' Season 4: Details & Release Date Info for Netflix ...,0.0
2021-07-10,Netflix Users Furious That Cursed Has Been Cancelled,0.0
2021-07-10,"Best New TV Shows Added to Netflix This Week: July 10th, 2021",0.5681818181818181
2021-07-10,Are the Resident Evil movies on Netflix?,-1.0
2021-07-10,5 best shows on Netflix this weekend: Atypical season 4 and more,0.5
2021-07-10,Why Netflix movies look so weird,-0.5
2021-07-11,"What's Coming to Netflix This Week: July 12th to 18th, 2021",0.0
2021-07-11,When Does 'Fear Street Part 3: 1666' Come Out on Netflix?,0.0
2021-07-11,"What's New on Netflix This Week: July 11th, 2021",0.13636363636363635
2021-07-11,"Mitch Lowe, co-founder of Netflix: “American series are so ...",0.0
2021-07-11,"How Larry Tanz, Netflix’s VP Of Original Series For EMEA, Is Radically Expanding The Streamer’s Web Of Inclusivity",0.375
2021-07-11,Horror Movie 'The Old Ways' Coming to Netflix in August 2021,0.1
2021-07-11,7 Best New Movies on Netflix in July 2021,0.5681818181818181
2021-07-11,"Netflix's Katla Season 1 Ending, Explained",0.0
2021-07-12,Inside Shonda Rhimes’ Second Netflix Pact: A “Significant” Raise and New Revenue Streams,0.17045454545454544
2021-07-12,Netflix and Gold House Form Netflix Gold Partnership to Promote API Content (Exclusive),0.0
2021-07-12,Nickelodeon's Avatar Franchise Is Thanks to Netflix Popularity,0.2
2021-07-12,It’s Clear Netflix Should Change Its Mind About ‘Manifest’ Season 4,0.10000000000000002
2021-07-12,Lior Raz Stars in New Netflix Thriller ‘Hit & Run’: Watch the Trailer,0.13636363636363635
2021-07-12,‘King Of Spies’: ‘Jupiter’s Legacy’ Creator Mark Millar Teams With Netflix For In-House Graphic Novel,0.0
2021-07-12,Netflix's Havoc first to use mobile nursery,0.25
2021-07-12,Obamas' Higher Ground sets new film/TV project for Netflix,0.19318181818181818
2021-07-12,3 Great Reasons to Buy Netflix,0.8
2021-07-12,Gay Conversion Therapy Doc ‘Pray Away’ Releases Emotional Trailer (EXCLUSIVE),0.20833333333333334
2021-07-13,"2021 Emmy nominations network scorecard, HBO vs. Netflix",0.0
2021-07-13,Universal Animation Movies Hammer Post Peacock Multi-Year Pay Window With Netflix,0.0
2021-07-13,Netflix extends deal for animation films with Universal Pictures,0.0
2021-07-13,"Netflix, Universal Extend and Expand Animated Film Licensing Deal (EXCLUSIVE)",0.0
2021-07-13,Netflix Doc Series ‘Heist’ Tells The Real Stories Behind 3 Crazy Headlines,-0.26666666666666666
2021-07-13,When will Season 2 of 'The Cook of Castamar' be on Netflix?,0.0
2021-07-13,'Gunpowder Milkshake': Great cast has a blast in Netflix's ...,0.8
2021-07-13,Netflix Orders 3 Seasons Of ‘CoComelon Lane’ Animated Preschool Series & Specials,0.0
2021-07-13,Netflix ropes in dating app Tinder as official casting partner for first Indian dating reality show,0.25
2021-07-13,Where is Elize Matsunaga now? The killer wife of Marcos in Netflix's Once Upon a Crime,0.0
2021-07-14,Netflix (NFLX) To Offer Video Games on Its Streaming Platform,0.0
2021-07-14,Netflix hires Facebook gaming executive Mike Verdu as part of a deeper push into entertainment,0.0
2021-07-14,Netflix Expands Into Video Games With New Executive Hire,0.13636363636363635
2021-07-14,Netflix extends exclusive rights to Universal's animated films in the US,0.0
2021-07-14,Meghan Markle Preps Animated Series ‘Pearl’ For Netflix Via Archewell Productions,0.0
2021-07-14,"Netflix's 'Gunpowder Milkshake' is a stylish, violent piece of cotton-candy fluff",-0.13333333333333333
2021-07-14,Netflix's 'My Unorthodox Life': How Julia Haart escaped sect,0.0
2021-07-14,Netflix Has Some New Features for Kids (and Their Parents),0.13636363636363635
2021-07-14,"'Fear Street: 1666' goes full period-set, witch trial horror in trailer for Netflix's trilogy closer",0.35
2021-07-14,Where are Heather Tallchief and Roberto Solis Now? - True ...,0.35
2021-07-15,Netflix might launch a game streaming service like Stadia and Xbox Cloud - GSMArena.com news,-0.4
2021-07-15,Netflix and Gaming: A Brief History and What's Next,0.0
2021-07-15,"Netflix Wants To Be The Netflix Of Video Games, Good Luck",0.44999999999999996
2021-07-15,"Meghan Markle, Prince Harry to develop animated series for Netflix",0.0
2021-07-15,Netflix Fires Marketing Execs for Criticizing Bosses Over Slack,0.0
2021-07-15,'Gunpowder Milkshake' Netflix Movie Review,0.0
2021-07-15,"Netflix Taps Google, USC Researcher Paul Debevec to Lead VFX, Graphics R&D",0.0
2021-07-15,Netflix Increases Shonda Rhimes $100 Million Deal For A Bigger Stake In Culture,0.0
2021-07-15,The Netflix series 'Naomi Osaka' reveals much about the ...,0.2
2021-07-15,"13 Emmy-nominated movies and shows that you can watch on Netflix, Amazon Prime Video, and Disney+ Hotstar",0.0
2021-07-16,Netflix is starting a games division focused on interactive ...,0.0
2021-07-16,Netflix Is Looking To Offer Video Games On Its Platform & It May Not Be A Good Idea,0.7
2021-07-16,Netflix is getting into game development,-0.4
2021-07-16,"Netflix Plans to Expand Into Gaming Next Year, Rumors Suggest Partnership with Sony to Bring Their Games to the Service",0.0
2021-07-16,Meghan Markle’s first Netflix Project Is Coming,0.25
2021-07-16,How Netflix turned a slasher trilogy into a summer movie ...,0.0
2021-07-16,Netflix Opens Massive New York Studio in Brooklyn - Bloomberg,0.06818181818181818
2021-07-16,"Netflix Promotes Kira Goldberg and Ori Marmur, Executives Will Lead New Team Developing Commercial Films (EXCLUSIVE)",0.06818181818181818
2021-07-16,How many Twilight movies are on Netflix?,0.5
2021-07-16,'Never Have I Ever': Gigi Hadid replaces Chrissy Teigen on ...,0.0
2021-07-17,Netflix's gaming plans aren't really about creating video games,0.2
2021-07-17,'Fear Street' trilogy: Netflix's villains all have killer inspiration,0.0
2021-07-17,5 good movies on Netflix to watch this weekend: Fear Street and more,0.6
2021-07-17,Feds Ask: Should Netflix Air Emergency Alerts?,0.0
2021-07-17,Former India employee Nandini Mehta sues Netflix over wrongful termination,0.0
2021-07-18,What does a mature streaming service look like? Netflix is about to show us,0.1
2021-07-18,Is Netflix's 'Never Have I Ever' Based on a True Story?,0.35
2021-07-18,Op-Ed: How the streaming wars are changing what you watch,0.0
2021-07-18,"‘Avatar: The Last Airbender’ Is Leaving Netflix, Where Is It Going?",0.0
2021-07-18,"What's Coming to Netflix This Week: July 19th to 25th, 2021",0.0
2021-07-18,Netflix Answered Whether Brad's Penis Is Above Average on ...,-0.075
2021-07-18,‘Matilda’ Becomes Second Netflix Production In The UK To Suffer Covid Outbreak,0.0
2021-07-18,Fear Street Part 4 is not coming to Netflix in July 2021,0.0
2021-07-18,Asa Butterfield Netflix Horror 'CURSR': What We Know So Far,0.1
2021-07-18,Ailenizle Birlikte İzleyebileceğiniz Jumanji Benzeri 10 Film,0.0
2021-07-19,"Netflix Has A 'Radical Candor' Culture, But Fires Three ...",0.0
2021-07-19,Netflix Adding Video Games: Everything We Know,0.0
2021-07-19,Will there be video games on Netflix?,0.0
2021-07-19,"Fear Street 4 release date, cast and more about Netflix sequel",0.5
2021-07-19,BB Easton Talks About The Message Behind Her Memoir And The Netflix Hit ‘Sex/Life’,-0.4
2021-07-19,30 Rock Returning to Netflix in August,0.0
2021-07-19,When will 'Avatar: The Last Airbender' & 'Legend of Korra ...,0.0
2021-07-19,NBC's mystery drama Manifest is a big hit on Netflix – but ...,0.0
2021-07-19,‘The World Is Yours’ Director Romain Gavras Teams With Ladj Ly On Netflix Film,0.0
2021-07-19,The Best Order to Watch Netflix's 'Fear Street' Movies In,1.0
2021-07-20,Netflix confirms move into video games as its growth slows,0.0
2021-07-20,Netflix explains why it’s getting into video games,0.0
2021-07-20,"Netflix Adds 1.5 Million Total Subscribers, But Loses Ground in U.S./Canada",-0.15
2021-07-20,"Netflix 'Kingdom: Ashin of the North,' prequel to hit series, to be released",0.0
2021-07-20,Netflix's 'UNTOLD' to dive deep into epic sports moments,0.05
2021-07-20,"'Sweet Tooth,' 'Army of the Dead' Rack Up Big Netflix View ...",0.04999999999999999
2021-07-20,Netflix sets cast for adaptation of Ernest ghost story,0.0
2021-07-20,All 5 Twilight movies made Netflix’s most-watched list in first week,0.25
2021-07-20,Line of Duty's Kelly Macdonald to lead Netflix thriller I Came ...,0.0
2021-07-20,"Actually, maybe Netflix and NBC will bring back Manifest",0.0
2021-07-21,Netflix execs explain why they're getting into video games — to learn from users,0.0
2021-07-21,Netflix turns to games as streaming growth slows,0.0
2021-07-21,Netflix wants to focus on mobile games first,0.225
2021-07-21,Netflix's animated Witcher movie gets its first proper trailer ...,0.125
2021-07-21,The Witcher: Nightmare of the Wolf trailer jumps back in time ...,0.0
2021-07-21,'Sexy Beasts': How they made the Netflix dating show's masks,0.5
2021-07-21,Zack Snyder's Stone Quarry Productions Signs First-Look Film ...,0.0
2021-07-21,'Twilight' Occupies All 5 Top Spots Among Netflix's Most ...,0.5
2021-07-21,Netflix’s Head of Physical Production Ty Warren to Exit in Reorganization (Exclusive),0.0
2021-07-21,Manifest season 4 in talks to air on Netflix,0.0
2021-07-22,"Netflix is going to be gaming's next big thing, forget the ...",0.0
2021-07-22,NorCal is a 'character' in Netflix's top show 'Virgin River',0.5
2021-07-22,16 Shows To Watch If You Loved Netflix's Sex/Life,0.7
2021-07-22,Get A First Look At Netflix's New Animated Series 'Ada Twist ...,0.19318181818181818
2021-07-22,Shailene Woodley and Felicity Jones in Netflix’s ‘The Last Letter From Your Lover’: Film Review,0.0
2021-07-22,"Poll: Are you one of the 430,000 people who recently ...",0.0
2021-07-22,Michelle Monaghan to Play Twins in Netflix Drama ‘Echoes’,0.0
2021-07-22,Zack Snyder is back for Army of the Dead 2 on Netflix,-0.1
2021-07-22,Sabrina boss reveals original season 4 ending scene that Netflix asked to be removed,0.375
2021-07-22,Netflix Option Traders Unimpressed After Earnings Miss,0.0
2021-07-23,Why Netflix is moving into gaming,0.0
2021-07-23,‘The Last Letter From Your Lover’ On Netflix: An Enduring Love Story,0.25
2021-07-23,Netflix Prank Summons Stalking Demon On A Huge Digital ...,0.20000000000000004
2021-07-23,Netflix to diversify further with first retail store opening,0.125
2021-07-23,Here's the Scary Reason Netflix's Q2 Subscriber Growth in the ...,-0.5
2021-07-23,Fire Tiger drops 'Resurrection Drink' to welcome Netflix's new ...,0.4681818181818182
2021-07-23,What Kariselle The Panda Really Looks Like On Netflix's Sexy ...,0.35
2021-07-23,Downton Abbey series 1 - 6 coming back to Netflix very soon,0.1
2021-07-23,Here's Why Fans Are Unhappy With Netflix's Masters of the ...,-0.6
2021-07-23,Netflix's 'World's Most Amazing Vacation Rentals' Best Rentals,0.7000000000000001
2021-07-24,Will Netflix Be a Trillion-Dollar Stock by 2030?,0.0
2021-07-24,Netflix's Sexy Beasts fails spectacularly to reinvent the dating ...,0.19999999999999998
2021-07-24,"'Lucifer' Season 6 - the Final, Final Season - Gets Premiere Date at Netflix (Video)",0.0
2021-07-24,A Terrible Bruce Willis Movie Has Been Dominating Netflix All ...,-1.0
2021-07-24,Lebanese singer Myriam Fares discusses new music and Netflix success,0.21818181818181817
2021-07-24,Les 4 scènes les plus chaudes d'Elite,0.0
2021-07-24,5 formas de baixar áudio do YouTube com modificações simples,0.0
2021-07-25,Zack Snyder lands big Netflix deal after Army of the Dead ...,-0.1
2021-07-25,Netflix is adding 20 new movies and shows this week,0.13636363636363635
2021-07-25,New on Netflix: Everything coming to and leaving streaming in August,0.13636363636363635
2021-07-25,Netflix Enters Middle Age. Brace for Speed Bumps.,0.0
2021-07-25,Wreck-it Ralph Writer Boards Netflix's Roald Dahl Series 'The ...,0.0
2021-07-25,"Netflix May Have Cancelled Fuller House, But Candace ...",0.0
2021-07-25,"Gong Hyo Jin la «Diosa Confiable», y su Próximo Proyecto",0.0
2021-07-26,‘Pokémon’ Live-Action Series in Development at Netflix — Report,0.0
2021-07-26,Pokémon Live-Action Series Coming to Netflix,0.0
2021-07-26,Netflix reportedly working on live-action Pokemon series from ...,0.0
2021-07-26,"Amanda Barclay Joins Netflix As Director Of Original Series, Comedy",0.375
2021-07-26,"Netflix’s ‘Blood Red Sky’ Is Surprisingly Fantastic, Given The Concept",0.2
2021-07-26,Zack Snyder’s ‘Army Of Thieves’: Netflix Releases First Trailer for ‘Army of the Dead’ Prequel (VIDEO),0.024999999999999994
2021-07-26,Co-creator of Netflix hit 'Outer Banks' calls East Tennessee home,0.0
2021-07-26,What's Coming to Netflix in August 2021,0.0
2021-07-26,‘Breathe’: Florencia Lozano & Juan Pablo Espinosa Join Netflix Survival Drama Series As Recurring,0.0
2021-07-26,Netflix's He-Man reboot has been panned by fans – and its ...,0.0
2021-07-27,It looks like Netflix has commissioned a live-action Pokémon ...,0.0
2021-07-27,Netflix Acquires Hot Package ‘Fast & Loose’ From STXfilms With Will Smith Starring And David Leitch Directing,0.12435897435897436
2021-07-27,"Netflix chooses Mumbai for first music creative, production team in APAC | Mint",0.375
2021-07-27,Watch the chilling trailer for Netflix's Dennis Nilsen documentary,-0.25
2021-07-27,Surrogate mother story Mimi arrives 4 days earlier on Netflix,0.0
2021-07-27,Netflix and the high cost of growing lower-revenue users,0.16
2021-07-27,What Time Will 'The Flash' Season 7 Be on Netflix?,0.0
2021-07-27,"What Is Blood Red Sky, the German Horror Movie That's No. 1 ...",0.0
2021-07-27,Christina Tosi's Bake Squad on Netflix Brings in Chicago's ...,0.0
2021-07-27,Is “Netflix Vs. Blockbuster” Happening To The Auto Industry?,0.0
2021-07-28,Netflix will require Covid vaccinations for actors and some crew on U.S. productions,0.0
2021-07-28,How Netflix Could Go Big in Gaming,0.0
2021-07-28,"NYC’s Paris Theater, The Cinema Netflix Rescued, Officially Reopens Aug. 6 With Streamer’s ‘The Forty-Year-Old-Version’",0.0
2021-07-28,YouTube is a proven juggernaut that rivals Netflix in the streaming wars,0.0
2021-07-28,‘Yes Day’ Sequel in Development at Netflix as Part of New Pact With Jennifer Garner,0.13636363636363635
2021-07-28,Netflix Boss: ‘I’m Going to Do Everything I Can’ to Get Christopher Nolan’s Next Movie,0.0
2021-07-28,Netflix Admits Michael Bay’s $150M ‘6 Underground’ Was a Miss: ‘We Didn’t Get There Creatively’,0.5
2021-07-28,"Reliance Jio plans that offers Netflix, Amazon Prime, Disney+ Hotstar subscription for free | Mint",0.25
2021-07-28,"What's New on Netflix & Top 10s: July 28th, 2021",0.3181818181818182
2021-07-28,Netflix is making another Will Smith movie – but this one might ...,0.0
2021-07-29,‘Sweet Tooth’ Renewed For Season 2 At Netflix,0.35
2021-07-29,We Now Know How Many Views a Netflix Blockbuster Needs to Be a Hit (Sort Of),0.5
2021-07-29,"Yes, Christopher Nolan Should Make Movies With Netflix — Here’s How He Could Negotiate a Deal",0.0
2021-07-29,Netflix wants Christopher Nolan's next movie – but would he ...,0.1
2021-07-29,"Jennifer Garner signs overall film deal with Netflix, sets sequel to Yes Day",0.0
2021-07-29,"New on Netflix in August 2021: Movies, TV shows and exclusives",0.13636363636363635
2021-07-29,Outer Banks filming location | Where drama is set,0.0
2021-07-29,Matt Bomer To Star In ‘Echoes’ Netflix Limited Series,-0.07142857142857142
2021-07-29,Vivo Trailer Reveals Netflix Animated Movie with New Lin ...,0.13636363636363635
2021-07-29,We've Witnessed Netflix's 'He-Man' Controversy Far Too Many ...,0.3
2021-07-30,Netflix Buys Michael Schumacher Documentary,0.0
2021-07-30,Netflix's new Schumacher documentary to show 'multi-layered personality' of 7-time champion,0.06818181818181818
2021-07-30,Netflix to release new Michael Schumacher documentary,0.06818181818181818
2021-07-30,Netflix Canada in August 2021: What’s new this month,0.13636363636363635
2021-07-30,"New on Netflix & Top 10 Shows & Movies: July 30th, 2021",0.3181818181818182
2021-07-30,"Centaurworld review: Netflix’s musical is adorable, until the body horror hits",0.25
2021-07-30,"New Netflix nail biter by ‘Fauda’ creators shifts between NYC, TLV",0.13636363636363635
2021-07-30,When is Outer Banks season 3 coming to Netflix?,0.0
2021-07-30,Netflix joins Hollywood studio producers' alliance,0.0
2021-07-30,Netflix releases first image of Imelda Staunton as the Queen in The Crown,0.25
2021-07-31,Netflix’s New Releases Coming in August 2021,0.13636363636363635
2021-07-31,"6 best shows on Netflix this weekend: Outer Banks, All American and more",0.5
2021-07-31,Netflix: Movies and TV Shows Leaving in August,0.0
2021-07-31,10 Black Movies to Stream on Netflix in August,-0.16666666666666666
2021-07-31,29 best true crime docuseries on Netflix,0.675
2021-07-31,How paying for Netflix and Amazon Prime could give your ...,0.0
2021-07-31,What is 30 Rock on Netflix about?,0.0
2021-07-31,Is Jungle Cruise on Netflix?,0.0
2021-07-31,"Catch Last Madame, Mr Unbelievable and 26 more Singapore ...",0.08333333333333333
2021-07-31,Is 'The White Lotus' Streaming on Netflix? How to Watch the ...,0.0
2021-08-01,"The Best Movies and TV Shows Coming to Netflix, HBO ...",1.0
2021-08-01,"What's New on Netflix & Top 10s: August 1st, 2021",0.3181818181818182
2021-08-01,"New on Netflix August 2021: Every new movie, TV & original arriving",0.2159090909090909
2021-08-01,Don’t Miss Netflix’s Best Horror Show You’ve Probably Never Heard Of,1.0
2021-08-01,A Look at Netflix's New Content Monetization Strategy,0.13636363636363635
2021-08-01,Is Gaia on Netflix?,0.0
2021-08-01,'Tiempo': El final explicado de la película de Shyamalan,0.0
2021-08-02,"Sources: HBO, Netflix lease space in Austin area for projects ...",0.0
2021-08-02,The Most Popular Shows On Netflix Right Now Besides 'Outer Banks',0.4619047619047619
2021-08-02,'The Originals' Leaving Netflix UK in September 2021,0.0
2021-08-02,'Resort to Love': Christina Milian's Netflix rom-com lessons,0.5
